,headline
1671,Help! How Do I Get Out of Resort Fees?
1672,Help! My Jewelry Was Stolen From My Hotel Room
1673,Helping Teenagers With Menstrual Pain
1674,Helping Towns by Seeding Their Own Backyard With Start-Ups
1675,Her Blog Post About Uber Upended Big Tech. Now She’s Written a Memoir.
1676,"Her Dream of Becoming a Doctor Turned Into a Nightmare, and a Movie"
1677,Her Grandmother Got the Coronavirus. Then So Did the Whole Family.
1678,Here Are the Cities Homeowners Never Leave
1679,Here Are the Guests for the State of the Union
1680,Here Comes the Coronavirus Pandemic
1681,"Here Lies the Skull of Pliny the Elder, Maybe"
1682,Here are the Guests for the State of the Union
1683,Here’s How Landlords Are Getting Around New Rent Laws
1684,Here’s How Tom Steyer’s Lavish Spending Divided South Carolina Democrats
1685,Here’s a look at the overall state of the race.
1686,Here’s a look at what’s at stake today.
1687,Here’s a look at what’s at stake today.
1688,"Here’s the Latest in Nordic TV, Noir and Otherwise"
1689,Here’s what the entrance polls are telling us.
1690,Here’s what to expect on Monday.
1691,Here’s where the candidates are spending caucus day.
1692,Here’s where the candidates will be on Wednesday.
1693,Here’s where we stand on Iowa results.
1694,"He’s Stared Down Activists and Apple, and Is Still in Charge"
1695,He’s in a Cab Franc State of Mind
1696,Hidden Beneath the Hospital Gown
1697,Hidden Beneath the Hospital Gown
1698,"High-Tech Tires, From Pit Lane to Your Garage"
1699,Highlights From the Democratic Debate in South Carolina
1700,Highlights from the candidates’ caucus night speeches.
1701,Highly Secretive Iranian Rebels Are Holed Up in Albania. They Gave Us a Tour.
1702,Highly anticipated Iowa poll is canceled.
1703,Highways Through Hell
1704,Hillary Clinton Slams Bernie Sanders for Not Working to Unite Democrats in 2016
1705,"Hired to Tame Horses, She Bonded With the People, Too"
1706,His Hats Are Worn by Bella Hadid and Madonna
1707,"His Son Hiked Into the Costa Rican Jungle, and Never Came Out. What Happened?"
1708,Hockney Painting Makes a Medium-Size Splash at Sotheby’s
1709,"Home 2, Visitor 1, Spectators 0"
1710,Home at Last From China: A Foreign Exchange Student’s Travel Ordeal
1711,"Homes That Sold for $450,000 or Less"
1712,Homes That Sold for Around $1.5 Million
1713,"Homes That Sold for Around $600,000"
1714,"Homes That Sold for Around $750,000"
1715,"Homes for Sale in Brooklyn, Queens and Manhattan"
1716,"Homes for Sale in Brooklyn, Queens and Manhattan"
1717,"Homes for Sale in Brooklyn, Queens and Manhattan"
1718,"Homes for Sale in Brooklyn, Queens and Manhattan"
1719,Homes for Sale in New Jersey and Connecticut
1720,Homes for Sale in New York and Connecticut
1721,Homes for Sale in New York and New Jersey
1722,Homes for Sale in New York and New Jersey
1723,Hong Kong Reports First Death From Coronavirus Outbreak
1724,Hong Kong Reports Its First Coronavirus Death as Outbreak Widens
1725,Hong Kong Says It Will Begin Evacuating Residents From Wuhan
1726,Hong Kong Tightens Border as Medical Workers Call for Shutdown
1727,Hope Hicks to Return to the White House After a Nearly Two-Year Absence
1728,"Hosni Mubarak, Egyptian Leader Ousted in Arab Spring, Dies at 91"
1729,"Hosni Mubarak, Egyptian Leader Ousted in Arab Spring, Dies at 91"
1730,Hotels Aim to Help Guests Travel Lighter
1731,"House Approves Puerto Rico Aid Package, but a Path Forward Is Murky"
1732,House Democrats Inquire About Political Interference at the Justice Dept.
1733,House Hunting in Berlin: A Kaleidoscope of Style for $3.2 Million
1734,House Hunting in Guatemala: A Restored Colonial-Era Villa
1735,House Hunting in Japan: A Modern Ski Cabin in the Woods
1736,House Hunting in Toronto: An Original Midcentury-Modern for $1.6 Million
1737,House Votes to Ban Flavors in Cigarettes and E-Cigarettes
1738,House Votes to Extend Deadline to Ratify Equal Rights Amendment
1739,"House rushed to wield ‘the ultimate nuclear weapon of the Constitution,’ Trump defense argues."
1740,"House rushed to wield ‘the ultimate nuclear weapon of the Constitution,’ Trump’s defense argues."
1741,How Abortion Warps Our Politics
1742,How Afghans Can Work Together to End the War
1743,How Alabama’s Senate Primary Became a Trump Loyalty Contest
1744,How Amy Klobuchar Pulled Off the Big Surprise of the New Hampshire Primary
1745,How Amy Klobuchar Suddenly Became a Rival Worth Attacking
1746,How Andrew Yang Handled His Asian-American Identity on the Campaign Trail
1747,How BTS Filmed a ‘Top Secret’ Video in Grand Central Terminal
1748,How Bad Could It Get? Companies Gauge the Coronavirus Impact
1749,How Bad Will the Coronavirus Outbreak Get?
1750,How Barcelona Lost Its Way
1751,How Bernie Sanders Dominated in Nevada
1752,How Biden’s Campaign Explains His ‘Arrest’ in South Africa
1753,How Bloomberg Bungled a Debate That He Had Been Prepped For
1754,How California Is Responding to Coronavirus
1755,How Can I Open Myself Up to New Romantic Relationships?
1756,How Can a Kid Today Hear His Inner Voice?
1757,How China Tracked Detainees and Their Families
1758,How Churchill Brought Britain Back From the Brink
1759,How Colum McCann Shaped Loss Into a Book
1760,How Common Mental Shortcuts Can Cause Major Physician Errors
1761,How Concerned Are You About the Coronavirus Outbreak?
1762,How Cooking Dinner Can Change Your Life
1763,How Do I Deal With My Obnoxious Neighbors?
1764,"How Do You Decide What News to Believe, What to Question and What to Dismiss?"
1765,How Do You Explain the History of Reproductive Rights to Teenagers?
1766,How Do You Solve a Problem Like ‘Emma’?
1767,How Does a Buddhist Monk Face Death?
1768,How Does the Coronavirus Compare to the Flu?
1769,How Dorothea Lange Defined the Role of the Modern Photojournalist
1770,How Dresden Looked After a World War II Firestorm 75 Years Ago
1771,How Elizabeth Warren’s Camp Is Seeking to Regain the Spotlight
1772,How Europe Turned Into a Perfect Landscape for Wildfires
1773,"How Exercise Might Affect Our Food Choices, and Our Weight"
1774,How Fear Distorts Our Thinking About the Coronavirus
1775,How Fear Distorts Our Thinking About the Coronavirus
1776,How Have You Learned About Slavery?
1777,"How Kobe Bryant Made Everyone, Including the Haters, Respect His Game"
1778,How Laurie Metcalf Became the Sarah Bernhardt of Broadway
1779,How Libraries Saved Cheryl Strayed
1780,How Many Coronavirus Cases in China? Officials Tweak the Answer
1781,How Many Hockey Teams Does it Take to Make a Conference?
1782,How Marc Jacobs Procrastinates in the Lead-Up to Fashion Week
1783,How Mexico’s Muralists Lit a Fire Under U.S. Artists
1784,How Millennials Could Make the Fed’s Job Harder
1785,How Mitch McConnell Delivered Acquittal for Trump
1786,How Monkeys Taught Me to Appreciate Teen Sleepovers
1787,How Months of Miscalculation Led the U.S. and Iran to the Brink of War
1788,How Morning and Afternoon People Can Get Along at Work
1789,How Much Has the California Primary Mattered in the Past?
1790,How Much Racism Do You Face in Your Daily Life?
1791,How Much Watching Time Do You Have This Weekend?
1792,How Much Watching Time Do You Have This Weekend?
1793,How Much Watching Time Do You Have This Weekend?
1794,How Much Watching Time Do You Have This Weekend?
1795,How My Worst Date Ever Became My Best
1796,How Never Trumpers Fell in Line
1797,How New York City Lost Boxing
1798,How Not to Fight About Money After Kids
1799,How Not to Get Hacked: Learning From Jeff Bezos
1800,How Not to Get Sick While Traveling
1801,How One Couple Transformed Their Brooklyn Brownstone to Age in Place
1802,How Pete Buttigieg Became the Surprise of the Iowa Caucuses
1803,How Politics Plays Out in Textbooks
1804,How Prepared Is the U.S. for a Coronavirus Outbreak?
1805,"How Rashad Robinson, Racial Justice Activist, Spends His Sundays"
1806,How Senators Explain Their Votes in Trump’s Impeachment Trial
1807,How Technology Is Changing the Future of Higher Education
1808,How They Learned to Drive. And Why They’re Driving Again.
1809,How Trump Got Trickled Down
1810,How Trump Is Remaking the Highest Office in His Own Image
1811,"How Trump Is Running to Snatch Victory From the Jaws of Defeat, Again"
1812,How Trump Wins Again
1813,How Trump’s Relationship With Barr Got So Complicated
1814,How Will Tech Help in a Time of Pandemic?
1815,How Will Trump’s Supreme Court Remake America?
1816,How Will the Winner of the Iowa Caucuses Be Chosen? Here’s What You Should Know
1817,How Would You Design Your Ideal Museum?
1818,How Zombies Ate the G.O.P.’s Soul
1819,How a Champion of Female Filmmakers Spends Her Sundays
1820,How a Clash of Egos Became Bigger Than Fixing the Subway
1821,How a Downtown Bar Baron Spends His Sundays
1822,How a Fake Priest Duped Oxford and a World-Famous Historian
1823,How a Health Aide Won Her Ex-Client’s $283-a-Month Apartment
1824,How a Homeless Couple Found Work Delivering Eviction Notices
1825,How a Hong Kong Campus Became a Fiery Battlefield
1826,How a Hong Kong Campus Became a Fiery Battlefield
1827,How a Neighbors’ Feud in Paradise Launched an International Rape Case
1828,How a Persian Mystic Poet Changed My Life
1829,How a Pharmacy Handles Mask Hoarders and Coronavirus Fears
1830,How a Vegan Ends Up With Leather in Her Portfolio
1831,How a six-year strike in the 1990s relates to the conflict over ‘Medicare for All’ in Nevada.
1832,How an Amputee Dancer Spends His Sundays
1833,How an Author and His Husband Host Casual Dinners in Their New York Apartment
1834,How an Education Visionary Got Canceled
1835,How are ‘satellite’ votes being measured in Iowa? Good question.
1836,How many other states hold caucuses?
1837,How powerful is Wilder’s right hand?
1838,How the Arabic Alphabet Inspired Abstract Art
1839,How the Chiefs Beat the 49ers to Win the Super Bowl
1840,How the Coronavirus Numbers Changed So Sharply
1841,How the Coronavirus Numbers Changed So Sharply
1842,How the Far Right Became Europe’s New Normal
1843,How the Founder of Black Voters Matter Thinks About Bloomberg
1844,How the Iowa Caucuses Became an Epic Fiasco for Democrats
1845,"How the caucuses should work, and what could go wrong."
1846,How to Be Good
1847,How to Be More Optimistic
1848,How to Be a Smart Coronavirus Prepper
1849,How to Be an Expatriate in 2020
1850,How to Bring the Vision of an Instagram Decor Influencer Into Your Home
1851,How to Build Healthy Habits
1852,How to Build a Media Company
1853,How to Build a Pretty Macrobiotic Meal Like a Jewelry Designer
1854,How to Buy Wine: Five Questions to Ask
1855,How to Deal With the Anxieties of Immigration? Break Into Song
1856,How to Dress for a Job Interview
1857,How to Find the Best C.P.A. or Tax Accountant Near You
1858,How to Get The New York Times on Your Smart Speaker
1859,How to Herd Reindeer
1860,How to Keep Your Proposal a Surprise (Hint: Ditch the Box)
1861,How to Make Your Marriage Gayer
1862,How to Prepare for the Coronavirus
1863,How to Put on a Fashion Show Without a Designer
1864,How to Quarantine at Home
1865,How to Raise Siblings Who Get Along
1866,How to Serve Fonio
1867,How to Set Up Your New Car
1868,How to Spin a Sign
1869,How to Stop a Disease From Crossing Borders
1870,How to Take Control of Your Notifications
1871,How to Take Equity Out of a Co-op
1872,How to Taste Chocolate
1873,"How to Watch Super Bowl 2020: Kickoff Time, Halftime and More"
1874,"How to Win the Democratic Nomination, and Why It Could Get Complicated"
1875,How to Write Fiction When the Planet Is Falling Apart
1876,How will each side conclude its arguments?
1877,How ‘Pandora and the Flying Dutchman’ Still Casts a Spell
1878,How ‘Pandora and the Flying Dutchman’ Still Casts a Spell
1879,How ‘Portrait of a Lady on Fire’ Sees Power in Two Women in Love
1880,How’s Elizabeth Warren feeling? ‘Good.’
1881,"Huawei Is Winning the Argument in Europe, as the U.S. Fumbles to Develop Alternatives"
1882,Hudson Yards Is Coming for Your Soul
1883,"Huge Shelters for Coronavirus Patients Pose New Risks, Experts Fear"
1884,Hundreds Confined to Tenerife Hotel for 14 Days Over Coronavirus Fears
1885,Hundreds Released From Diamond Princess Cruise Ship in Japan
1886,Hundreds of Americans Were Evacuated From the Coronavirus Epicenter. Now Comes the Wait.
1887,Hunting Conference With Beach Boys and Trump Jr. Draws Protests
1888,"Hurricane Dorian Ravaged Bahamas’ Reefs, Researchers Find"
1889,I Admire Vegetarians. It’s a Choice I Won’t Ever Make.
1890,"I Can’t Hear You, There’s a Debate Going On"
1891,I Didn’t Know My Father Until I Read His Love Letters to My Mother
1892,I Don’t Want to Be the Strong Female Lead
1893,"I Dreaded Black History Month, Until a Novelist Opened My Eyes"
1894,I Feel Personally Judged by J. Lo’s Body
1895,I Had a Gloriously Wild Childhood. That’s Why I Wrote ‘How to Train Your Dragon.’
1896,I Had a Gloriously Wild Childhood. That’s Why I Wrote ‘How to Train Your Dragon.’
1897,I Have $24 in My Savings Account. Can Microsavings Make Me a Better Saver?
1898,I Have $24 in My Savings Account. Can Microsavings Make Me a Better Saver?
1899,I Have a Story for Pope Francis About Priestly Celibacy
1900,I Helped Create the Nation’s Top Spy Job. It's About to Be Destroyed.
1901,I Love You (But Do You Love Mariah Carey?)
1902,I Performed at the Super Bowl. You Might Have Missed Me.
1903,I Quit My Bank. Am I Saving the World?
1904,I Spent Hours Talking to Victims. These Verdicts Will Give Them Hope.
1905,I Tried 6 Popular Anti-Snoring Devices. Here’s How They Did.
1906,I Used to Be a Taylor Swift Fan. ‘Miss Americana’ Reminded Me Why.
1907,"I Voted for Trump, and I Believe He May Be Guilty of Bribery"
1908,I Wanted to Understand Iowa. So I Moved There.
1909,I Was the First Woman of Color in Space. Here’s What Katherine Johnson Means to Me.
1910,I Was the Judge in the Stop-and-Frisk Case. I Don’t Think Bloomberg Is Racist.
1911,I Went to a Brexit Celebration Party
1912,"I Worry About Sanders, and His Coattails"
1913,"IBM, Marriott and Mickey Mouse Take On Tech’s Favorite Law"
1914,"If Bernie Wins, Where Will He Take the Democratic Party?"
1915,"If Trump is not removed, how can voters be sure the next election is fair, Jeffries asks."
1916,"If Your Brother Committed a Terrorist Act, Would You Forgive Him?"
1917,Imagine Bernie Sanders in the Oval Office
1918,Imagine That Donald Trump Has Almost No Control Over Justice
1919,Imagine That Donald Trump Has Almost No Control Over Justice
1920,Imagining a pink White House.
1921,"Immigrants Could Face Nearly $1,000 Charge to Appeal Deportation Orders"
1922,"Impact of the Coronavirus Ripples Across Asia: ‘It Has Been Quiet, Like a Cemetery’"
1923,"Impeachment All but Behind Him, Trump Celebrates and Keeps Focus on Bloomberg"
1924,Impeachment Briefing: Closing Arguments
1925,Impeachment Briefing: Impeachment’s Legacy
1926,Impeachment Briefing: Senate Votes to Block Witnesses
1927,Impeachment Briefing: Trump Is Acquitted
1928,Impeachment Briefing: Trump’s Celebration
1929,Impeachment Then and Now: What Three Presidential Sites Can Teach Us
1930,"Impeachment Trial Updates: Senate Acquits Trump, Ending Historic Trial"
1931,Impeachment Trial: What to Watch Before the Final Votes
1932,Impeachment manager invokes McCain in a jab at Trump.
1933,"Impeachment, Iowa, Banksy: Your Wednesday Evening Briefing"
1934,"Impeachment, Iowa, Oscars: Your Thursday Evening Briefing"
1935,"Impeachment, Iowa, Super Bowl: Your Weekend Briefing"
1936,"In 1980s Glasgow, a World of Pain Made Bearable by Love"
1937,"In 6 Minutes, You Can Be Done With Your Workout"
1938,"In 6 Minutes, You Can Be Done With Your Workout"
1939,"In Amazon’s Bookstore, No Second Chances for the Third Reich"
1940,"In Australia’s Most Populous State, ‘All Fires Are Contained’"
1941,"In Bipartisan Bid to Restrain Trump, Senate Passes Iran War Powers Resolution"
1942,"In Bitter Delhi Election, Modi’s Party Suffers a Setback"
1943,"In Canada, the Cost of Youth Hockey Benches the Next Generation"
1944,"In Case on Wealth Test for Green Cards, a Scathing Sotomayor Dissent"
1945,"In China’s War on the Coronavirus, a Community Is Besieged"
1946,In College and Homeless
1947,"In Coronavirus Fight, China Sidelines an Ally: Its Own People"
1948,"In Coronavirus, $45-Billion Cruise Industry Faces a Big Challenge"
1949,"In Coronavirus, China Weighs Benefits of Buffalo Horn and Other Remedies"
1950,"In Delaware, Dams Are Being Removed to Spur Fish Migration"
1951,"In Diamonds, Brown Is ‘Much More Mysterious’"
1952,"In England, Closing a Chapter of Modern Dance"
1953,"In Europe, Fear Spreads Faster Than the Coronavirus Itself"
1954,"In Fight to Stop Human Trafficking, Nuns Take to the Streets"
1955,"In Graying Japan, Many Are Vulnerable but Few Are Being Tested"
1956,"In His New Book, Daniel Kehlmann Says Hello to a Cruel World"
1957,"In Hollywood, Stories About People of Color Are Still Rare. These Y.A. Fantasy Novels Pick Up the Slack."
1958,"In Hong Kong, the Coronavirus Strikes a Wounded City"
1959,"In Iraq, Where Beauty Was Long Suppressed, Art Flowers Amid Protests"
1960,"In Jewelry, a Mix of Design and Sales"
1961,"In L.A., Kobe Dominates the Paint"
1962,"In Libya, Toothless U.N. Embargo Lets Foreign States Meddle With Impunity"
1963,"In London, Contemporary Anxieties Take the Stage"
1964,"In Los Angeles, a Historic Home Becomes an Experimental Kitchen"
1965,"In Los Angeles, a Hug That Seems to Never (Ever) End"
1966,"In Marriage, It’s Not About the Dishes. It’s About Respect."
1967,In Memoriam
1968,"In Mubarak’s Legacy, Egyptians See the Failings of the Arab Spring"
1969,"In New Hampshire, Joe Biden looks forward to ‘heading south.’"
1970,"In Nova Scotia, Homes as Wild as the Landscape Around Them"
1971,"In One State, a Holdout Juror Can’t Block a Conviction. That May Not Last."
1972,"In Paris, a New Fashion Nexus Comes With a Canteen"
1973,"In Poland, Controversial Legislation Restricting Judiciary Is Signed Into Law"
1974,"In Pop Smoke Murder Investigation, Evidence Sends Mixed Messages"
1975,"In Private, Republicans Admit They Acquitted Trump Out of Fear"
1976,"In Prosperous California, Anxiety Over Inequality Abounds"
1977,"In Queens, a Food Bazaar With the Vastness and Variety of Indonesia"
1978,"In Rare Statement, Fed Chair Keeps Rate Cut on Table as Virus Risks Roil Markets"
1979,"In Rural Nigeria, a Heroine Who Wants to Be Defined by More Than Marriage"
1980,"In Rye, a little fun on one side as voting takes place on the other."
1981,In Search of Darkness
1982,In Search of Darkness
1983,In Search of Economic Patriots
1984,"In Sudden Move, Chicago Tribune's Top 2 Editors Are Departing"
1985,"In Syria and Libya, Trump Is Torn Over 2 Wars, and 2 Strongmen"
1986,"In These Elegant Comics, Love and Darkness Collide"
1987,"In Trade for Betts, Another of Astros’ Vanquished Opponents Bulks Up"
1988,"In Trippy Times, Bill Graham Took Care of Reality"
1989,"In Trump Country, the Resistance Meets the Steel Curtain"
1990,"In Trump’s Budget, Big Health Care Cuts but Few Details"
1991,"In U.S. and Germany, Community Transmission Is Now Suspected"
1992,"In a Battle for Female Personhood, These Plays Are on the Front Lines"
1993,"In a City Under Lockdown, Hope Arrives by Motorbike"
1994,"In a Long History of Sexist Ads and Outrage, It’s the Apology That’s New"
1995,"In a Long History of Sexist Ads and Outrage, It’s the Apology That’s New"
1996,"In a Post-‘Parasite’ World, What Happens Next?"
1997,"In exchange over Iowa results, Biden calls voter ‘a lying dog-faced pony soldier.’"
1998,"In post-debate ad, Joe Biden compares his record to Pete Buttigieg."
1999,"In post-debate ad, Joe Biden compares his record with Pete Buttigieg’s."
2000,"In the Age of Digital Streaming, Are Movie Theaters Still Relevant?"
2001,"In the Deal to Sell the Mets, a Snag Fits a Familiar Pattern"
2002,"In the Heart of Israel’s ‘Start-up Nation,’ an Exclusive Scene Opens Up"
2003,"In ‘Amnesty,’ an Immigrant’s View Conveyed With Authority and Wit"
2004,"In ‘Coal Country,’ Memories From a Mining Tragedy Live On"
2005,"In ‘Dispatches From Elsewhere,’ Art Imitates Art Imitating Life"
2006,"In ‘Hunters,’ Al Pacino Stalks Nazis Into New Territory"
2007,"In ‘We Are the Dream,’ Oakland Students Channel Dr. King"
2008,"Independent Voters See Economy Improving, a Potential Boon to Trump"
2009,"India Set to Stage an Epic Show, With Trump as the Star"
2010,Indian Brides Say ‘Yes’ to Lehengas Near and Far (Very Far)
2011,"Indian Police Sweep Through Riot Zone, Making More Arrests"
2012,Indonesia Deports U.S. Journalist Jailed Over Visa Issue
2013,Indonesia Has No Reported Coronavirus Cases. Is That the Whole Picture?
2014,"Infection Numbers Spike in South Korea, and Fear Builds"
2015,Ink Rx? Welcome to the World of Paramedical Tattoos
2016,Inmate No. 3102000153: What Awaits Harvey Weinstein Behind Bars
2017,"Inside The Wall Street Journal, Tensions Rise Over ‘Sick Man’ China Headline"
2018,"Inside The Wall Street Journal, Tensions Rise Over ‘Sick Man’ China Headline"
2019,Inside a Book
2020,Inside the 2020 Oscar Parties
2021,Inside the Funhouse Action Scene From ‘Birds of Prey’
2022,Inside the New York City Bodegas Going Viral on TikTok
2023,Inside the Push to Turn Out Latino Voters in Nevada
2024,Inside the Race to Contain America’s First Coronavirus Case
2025,Into the Black Forest With the Greatest Living Artist
2026,"Introducing the Needle, the New Hampshire Version"
2027,Intuit Is Expected to Buy Credit Karma in $7 Billion Deal
2028,Intuit Is Expected to Buy Credit Karma in $7 Billion Deal
2029,Intuit to Buy Credit Karma to Create Financial Data Giant
2030,"Inundated With Flu Patients, U.S. Hospitals Brace for Coronavirus"
2031,Investigations Into 2020 Candidates Must Be Cleared by Top Justice Dept. Officials
2032,Iowa Caucus Results Riddled With Errors and Inconsistencies
2033,"Iowa Caucus, State of the Union, Rush Limbaugh: Your Tuesday Briefing"
2034,"Iowa City’s mayor endorses Buttigieg: ‘I don’t know if you know this, but I’m black.’"
2035,Iowa Could Have Multiple Candidates Declare Victory. Let Us Show You How.
2036,Iowa Could Have Multiple Candidates Declare Victory. Let Us Show You How.
2037,Iowa Democratic Party chair to hold news conference.
2038,Iowa Democratic Party says it will conduct a recanvass if a campaign requests it.
2039,"Iowa Democrats Complete Recanvass, but No Delegates Are Shifted"
2040,Iowa Democrats Give Buttigieg the Most Delegates as Sanders Team Seeks Recanvass
2041,"Iowa Democrats Release Partial Caucus Results, but No Winner Yet"
2042,Iowa Democrats give Buttigieg the most delegates. But counting errors remain.
2043,Iowa Democrats release a new batch of results.
2044,"Iowa Democrats release partial results, giving Pete Buttigieg an early lift."
2045,Iowa Democrats release partial results.
2046,Iowa Democrats say they’ll respond to the campaigns’ recanvass requests in 48 hours.
2047,Iowa Democrats vote to certify caucus results.
2048,"Iowa Democrats won’t correct errors on caucus tally sheets, emails show."
2049,"Iowa Democrats, still sorting out the caucus mess, will re-examine 95 precincts."
2050,Iowa Results: What We Know So Far
2051,Iowa Will Have 4 Sets of Results. Here’s How The Times Will Declare a Winner.
2052,Iowa Woman Declared Mentally Incompetent in Hit-and-Run Cases Tied to Race
2053,Iowa caucus app errors fuel conspiracy theories by Republicans.
2054,Iowa in Disarray: This Week in the 2020 Race
2055,"Iowa is sort of, maybe, actually over."
2056,"Iowa, Coronavirus, J.Lo: Your Monday Evening Briefing"
2057,"Iowa, Iowa, Iowa: This Week in the 2020 Race"
2058,"Iowa, State of the Union, Taylor Swift: Your Tuesday Evening Briefing"
2059,Iowans contemplate losing their spot at the front of the calendar.
2060,Iowa’s Republicans Unite for Trump (Romney Holdouts Aside)
2061,Iowa’s Unholy Mess
2062,Iowa’s in Love Again. Sort Of.
2063,Iowa’s senators and governors defend the state’s role in nominating process.
2064,Iran Again Fails to Put Satellite Into Orbit
2065,"Iran Remains on Antiterrorism Blacklist, Continuing Sanctions"
2066,Iran Vice President Is One of 7 Officials to Contract Coronavirus
2067,Iran’s Economy Is Bleak. Its Stock Market Is Soaring.
2068,Iran’s Stacked Election Is Expected to Produce a Hard-Line Parliament
2069,Iraq Names New Prime Minister Who Praises ‘Bravery’ of Protesters
2070,Ireland’s Independence Centenaries Threaten to Reopen Old Wounds
2071,Irish Voters Cast Off Relic of Entrenched 2-Party System
2072,Is 2020 the Last Year That Iowa Will Go First?
2073,Is Bloomberg the Democrats’ Best Hope?
2074,Is Broadway Stuck on Replay?
2075,Is Childhood Today Over-Supervised?
2076,Is Coffee Good for You?
2077,Is Harvey Weinstein’s Conviction a #MeToo Victory?
2078,Is It Time to Remake Our Digital Lives?
2079,Is It Too Soon to Write Off Michael Bloomberg?
2080,Is It a Good Idea to Use an In-House Broker?
2081,Is It a Pandemic Yet?
2082,Is My Adult Son Too Old for House Rules?
2083,Is There Such a Thing as a ‘Sugar High’?
2084,Is This Coronavirus ‘the Big One’?
2085,Is This New York City’s Nicest Public Bathroom?
2086,Is This the Best Opera Singer You’ve (Probably) Never Heard Of?
2087,Is This the Next Leader of the Fed?
2088,"Is Travel to Italy and Asia Safe? Your Coronavirus Questions, Answered"
2089,Is Virgil Abloh the Karl Lagerfeld for Millennials?
2090,Is it OK to Call Someone ‘Tiger’ at Work? Rowwwr!
2091,Is the Black Quarterback Revolution Going to Last?
2092,Is the Coronavirus an Epidemic or a Pandemic? It Depends on Who’s Talking
2093,Isamu Noguchi Artwork in Midtown Building Is in Peril
2094,Israel Accuses Hamas of ‘Catfishing’ Soldiers to Plant Malware
2095,Israel Puts Brakes on West Bank Annexation Plan
