,headline
2503,"Meat Increases Heart Risks, Latest Study Concludes"
2504,Mediating the Politics of Abortion
2505,"Medicare’s Private Option Is Gaining Popularity, and Critics"
2506,Meet Our New Los Angeles Bureau Chief
2507,Meet the Bird Medics of New Delhi
2508,Meet the Latinos Trying to Get Latinos to the Polls
2509,Meet the Unlikely Hero Saving California’s Oldest Weekly Paper
2510,Meet the ‘Pablo Escobar of the Falcon Egg Trade’
2511,Melissa Clark’s Favorite Bean-to-Bar Chocolates
2512,Memorial begins with a montage of Kobe and Gianna.
2513,"Men, You Need to Listen to Women"
2514,Menace Moving Through the Body
2515,Mental-Health Researchers Ask: What Is ‘Recovery’?
2516,Mental-Health Researchers Ask: What Is ‘Recovery’?
2517,Mentors Named for Rolex Arts Initiative
2518,Mentors and Debutantes
2519,Menú Ártico: sashimi congelado con guarnición de sangre de reno
2520,Men’s Wear Flies Its Freak Flag
2521,"Mercy Flight Leaves Yemen Capital, Cracking a 3-Year Blockade"
2522,"Merkel Succession Crisis in Germany Leaves Europe Leaderless, Too"
2523,Merkel’s Chosen Successor Steps Aside. The Far Right Cries Victory.
2524,Met Commissions Sculptures for Roof Garden and Facade Niches
2525,Met Museum Adjusts Painting’s History to Note Former Jewish Owner
2526,Met Museum Adjusts Painting’s History to Note Former Jewish Owner
2527,Met Opera Orchestra Plans First Tour in Nearly 20 Years
2528,Mexican Citizen Is Accused of Spying for Russians in the U.S.
2529,Mexico’s Last Countercultural Coast
2530,Michael Avenatti Is Convicted in Nike Extortion Trial
2531,Michael Bennet Drops Out of the 2020 Presidential Race
2532,Michael Bloomberg Has to Debate Without a Net
2533,Michael Bloomberg Leans Left With Plan to Rein In Wall St.
2534,Michael Bloomberg Surges in Polls and Qualifies for 2 Democratic Debates
2535,Michael Bloomberg Will Address Coronavirus in Prime-Time TV Ad
2536,Michael Bloomberg and the Long History of Misogyny Toward Mothers
2537,Michael Bloomberg’s Bankroll
2538,Michael Bloomberg’s Campaign Suddenly Drops Memes Everywhere
2539,Michael Bloomberg’s Longtime Partner Defends His Nondisclosure Agreements
2540,Michael Bloomberg’s Not-So-Secret Weapon
2541,Michael Friedman Left Behind a Musical. They’re Finishing It.
2542,Michael Hertz — You’ve Surely Seen His Subway Map — Dies at 87
2543,Michael Jordan had the one-liner of the day.
2544,Michael Jordan opens up about his friendship with Bryant.
2545,"Michael Jordan: ‘When Kobe Bryant Died, a Piece of Me Died’"
2546,"Michele Leddy, John Middlebrooks"
2547,Michelle Phillips: Caribbean Dreamin’
2548,Michigan Says It Is Investigating if Team Doctor Abused Students
2549,Mick Mulvaney Says He Often Disagrees With Trump (Just Never Publicly)
2550,"Mickey Wright, One of the Greatest Players in Women’s Golf, Dies at 85"
2551,Microbes Point the Way to Shipwrecks
2552,Microsoft Issues Financial Warning Because of Coronavirus
2553,Miedo y aversión en La Habana y Miami
2554,"Migrating Across the Waters, Shoulder to Shoulder"
2555,"Miguel Andujar’s Recovery: Rehab, Then Learn 2 New Positions"
2556,Mike Bloomberg Is Hacking Your Attention
2557,Mike Bloomberg: Fixing Inequality Is My Priority
2558,"Mike Hughes, 64, D.I.Y. Daredevil, Is Killed in Rocket Crash"
2559,Mike Pence vs. the Coronavirus
2560,Milk and Juice Are Not as Needed as You Might Think
2561,Millions of Americans Have Moved Off Assistance. Does Trump Get Credit?
2562,Millions of Californians have already voted by mail.
2563,Minimizing Risk in a Global Panic
2564,Minotaur’s Island
2565,"Mirella Freni, Matchless Italian Prima Donna, Dies at 84"
2566,Missing in Manchester: A Biden cheer section.
2567,Missing in Manchester: A big Biden cheer section.
2568,Mississippi Governor Declares Emergency Amid Rising Floodwaters
2569,Mitch McConnell Wasn’t Always Loved by Republicans. He Is Now.
2570,Mitt Romney Is a ‘Judas’ to Many Republicans. But Not in Utah.
2571,Mitt Romney’s Lonely Vote
2572,Mitt Romney’s ‘Spartacus’ Moment and Kirk Douglas’s Death
2573,Miuccia Prada Will Be Getting Sensitivity Training
2574,MoMA Names New Chief Photography Curator
2575,MoMA’s Atrium Set as Theatrical Stage for the Summer
2576,Moderate Democrats Fear Bernie Sanders Could Cost Them the House
2577,Moderates Search for a Savior
2578,"Modern Love Podcast: Brian Cox Reads ‘I Saw a Playhouse, My Daughter Saw a Jail’"
2579,"Modern Love Podcast: Nick Kroll Reads ‘Just for Tonight, Pretend You Don’t Know Me’"
2580,Modern Love Podcast: Susan Kelechi Watson Reads ‘When Cupid Is a Prying Journalist’
2581,"Modern Love Podcast: Terry Crews Reads ‘Dedicated to Two Women, Only One of Them Alive’"
2582,Modern Love Podcast: Tiny Love Stories Read by the People Who Wrote Them
2583,Modi Lost in Delhi. It Doesn’t Matter.
2584,Modi’s Budget Offers Few Solutions to Revive India’s Weak Economy
2585,Molson Coors Shooting in Milwaukee: What We Know
2586,"Money, Morality and a Challenge to Silicon Valley"
2587,"Monique Van Vooren, Actress With a Diverse Résumé, Dies at 92"
2588,Monmouth poll shows solid lead for Biden in South Carolina.
2589,Mookie Betts Deal Offers Painful Reminders of Boston’s Past
2590,More Chip in Levain’s Cookie
2591,More High-Price Closings at New Condo Tower Next to MoMA
2592,More Iowa results expected Wednesday afternoon.
2593,More Libraries Are Doing Away With Overdue Fines
2594,"More Money, More Problems for Democracy"
2595,"More Money, More Problems for Democracy"
2596,More Pain for N.J. Commuters: Tunnel Repairs Could Cause Big Delays
2597,More States Require Students to Learn About Money Matters
2598,"More Than 100 Troops Have Brain Injuries From Iran Missile Strike, Pentagon Says"
2599,More Than 15 Million Tuned In for CBS’s Democratic Debate
2600,More good polls for Sanders in California and Texas.
2601,More than $1 billion has been spent on primary ads. Over half came from Bloomberg.
2602,More white voters voted absentee than in 2016. What does that mean for the results?
2603,"Morgan Stanley to Buy E-Trade, Linking Wall Street and Main Street"
2604,Most Coronavirus Cases Are Mild. That’s Good and Bad News.
2605,Most of the candidates are spending the day in Super Tuesday states.
2606,Most polls have closed in New Hampshire.
2607,Mother Is Charged in Missing Idaho Children Case Complicated by Multiple Deaths
2608,Mother Nature Scoffs at Trump’s Mideast Peace Plan
2609,Motion Picture Academy Museum Will Open in December
2610,Motion Picture Academy Museum Will Open in December
2611,"Mourning My Mom, One Red Carpet at a Time"
2612,Movies Starring Women and People of Color Continue to Surge
2613,Mubarak’s Three-Decade Rule Is Brushed Aside in War-Hero Burial
2614,Muddled Democratic Race Hurtles to New Hampshire
2615,"Mudlarks Scour the Thames to Uncover 2,000 Years of Secrets"
2616,Muere por coronavirus el doctor chino que intentó advertir del brote
2617,Mumbai Police Play a Trick on Honking Drivers
2618,Murder and White Privilege on a Family Holiday in the Caribbean
2619,Museum-Quality Text Messages
2620,Muslims Should Disarm Islamophobia With Kindness
2621,Mutual Funds Are Still Keeping Secrets
2622,"My $145,000 Surprise Medical Bill"
2623,My Culture Is Not Super Bowl Entertainment
2624,My Daughter Died. How Do I Introduce Her to My Son?
2625,My Daughter Passes for White
2626,My Daughter Passes for White
2627,My Ex-Boyfriend’s New Girlfriend Is Lady Gaga
2628,My Ex-Boyfriend’s New Girlfriend Is Lady Gaga
2629,My Ex-Wife Bad-Mouths Me to Our Boys. Can I Tell Them the Truth About Her?
2630,My Father in Syria Needed Pills
2631,My Friend Lives Inside the War on Terror. Listen to Him.
2632,"My Mom, My Dad and Amazon’s Alexa"
2633,My Neighbor Is Putting Others at Risk. Can I Help Him Sell His Place?
2634,My Ritual With Kobe Bryant
2635,"My Sister, My Daughter: Behind the Scenes of a Great American Film"
2636,My Tireless Quest for a Tubeless Wipe
2637,"México, déjalos pasar"
2638,"N.B.A. Expects to Lose ‘Hundreds of Millions’ From China Rift, Silver Says"
2639,N.B.A. Trade Season Ensnares the Knicks and Andre Iguodala
2640,N.F.L. Ends Myles Garrett’s Indefinite Suspension
2641,N.F.L. Owners Approve Bargaining Agreement and Await Vote by Players
2642,N.F.L. Owners Propose Adding Two Teams to Playoff Format
2643,N.F.L. Players Aren’t Sold on Proposed 17-Game Season
2644,N.H. voters wonder ‘how do you not practice for something like this?’
2645,N.H.L. Game Postponed After Blues’ Jay Bouwmeester Collapses on Bench
2646,N.H.L. Takeaways From January
2647,"N.S.A. Phone Program Cost $100 Million, but Produced Only Two Unique Leads"
2648,N.Y.C.F.C. Is Close to Deal to Build Stadium in the Bronx
2649,N.Y.P.D. to Remove DNA Profiles of Non-Criminals From Database
2650,NASCAR Races Into an Uncertain Future
2651,NATO Eyes Troop Reductions in Afghanistan as U.S. Draws Down
2652,NOAA Leaders Privately Disowned Agency’s Rebuke of Scientists Who Contradicted Trump
2653,Nancy Pelosi (Literally) Rips Trump’s Speech Apart
2654,Nancy Pelosi declines to say if Democrats would back a nominee with only a plurality of delegates.
2655,Napping Away Winter in Montreal’s Nordic Spas
2656,"Nathaniel R. Jones, Rights Lawyer and Federal Judge, Dies at 93"
2657,National Archives’ Emails Show Little Debate Over Altering Photo of Women’s March
2658,National Security Wiretap System Was Long Plagued by Risk of Errors and Omissions
2659,Navy Secretary Pushed Out by Trump Says He’ll Endorse Bloomberg
2660,"Nearly 100 Years After Tulsa Massacre, City Plans to Search Cemetery for Victims"
2661,"Nedda Casei, Mezzo-Soprano Turned Labor Leader, Dies at 87"
2662,Need a New Driver’s License to Fly? Prepare for a Real Wait.
2663,"Nello Santi, Conductor With His Heart in Italian Opera, Dies at 88"
2664,"Netanyahu Announces New Homes in East Jerusalem, Days Before Election"
2665,Netflix Spent Big on Oscar-Worthy Films. That May Not Be Enough.
2666,"Netflix Users Rejoice: Goodbye, Autoplay"
2667,Nevada Caucuses Could Be a Preview of What’s to Come
2668,"Nevada Caucuses, Coronavirus, Kobe Bryant: Your Weekend Briefing"
2669,Nevada Democratic Party says more results are expected soon.
2670,Nevada Democrats Demand That Caucus Site Leaders Sign Nondisclosure Agreements
2671,Nevada Democrats Test a Caucus Plan ‘Without Something You Can Download on Your Phone’
2672,Nevada Democrats add phone lines for results reporting.
2673,Nevada Democrats don’t want caucus volunteers talking to the media.
2674,Nevada Democrats scrap plan to use caucus app.
2675,"Nevada Democrats’ Goal: Turn on iPads, Then Run Smooth Caucuses"
2676,Nevada Is Booming. But Not Everyone Is Feeling the Gains.
2677,Nevada Republicans also gathered. They backed the president.
2678,Nevada debate moderators are announced.
2679,Nevada’s Powerful Culinary Union Won’t Endorse in the Democratic Race
2680,Never Mind the Internet. Here’s What’s Killing Malls.
2681,Never Underestimate the Value of Crashing a Wedding
2682,"New & Noteworthy Audiobooks, From Caffeine to the Space Race"
2683,New & Noteworthy Poetry Books
2684,"New & Noteworthy, From Beautiful Crime to Essays on Identity"
2685,"New & Noteworthy, From Suffrage to Sexism"
2686,New Airbnb Listing: A 65-Foot-Tall Landmark Named Lucy the Elephant
2687,"New Bid to Legalize Abortion in Argentina, With President’s Backing"
2688,New Campus Sexual Misconduct Rules Will Tackle Dating Violence
2689,New Cases Are Reported as Beijing Sets New Rules
2690,New Cases Spike in Hubei Province
2691,New Cases in China Appear to Be Slowing
2692,"New Delhi Streets Turn Into Battleground, Hindus vs. Muslims"
2693,New Doubts From Iowa Caucuses: How ‘Satellite’ Votes Are Being Measured
2694,New Front in Trump’s Clashes With New York
2695,New Genomic Tests Aim to Diagnose Deadly Infections Faster
2696,New Hampshire Democrats Aren’t Just Voting
2697,"New Hampshire Primary Sets a Record for Turnout, but It May Be Deceiving"
2698,New Hampshire Usually Winnows the Field. This Year May Be Different.
2699,New Hampshire supporters chant ‘President Pete!’ after partial caucus results.
2700,"New Hampshire tends to vote for Democrats, but Trump hopes to change that."
2701,New Hampshire voters agree: We’re better than Iowa.
2702,"New Hampshire, Coronavirus, #MeToo: Your Wednesday Briefing"
2703,"New Hampshire, Coronavirus, Chocolate: Your Tuesday Evening Briefing"
2704,"New Hampshire, Roger Stone, Coronavirus: Your Wednesday Briefing"
2705,New Intelligence Chief Asks Election Czar to Remain in Post
2706,New Iowa results still show Buttigieg with a narrow lead.
2707,"New Iranian Missiles Pose Threat to U.S. Aircraft in Yemen, Pentagon Says"
2708,New Jersey May Raise Cigarette Taxes to Highest Level in Nation
2709,"New Literary Prize Will Award Over $100,000 to a Female Novelist"
2710,New Mexico Sues Google Over Children’s Privacy Violations
2711,New Origin Story for Gross Blobs That Wash Up on Beaches
2712,New Orleans Bans ‘Tandem Floats’ After 2 Are Killed Ahead of Mardi Gras
2713,New Paris Mayoral Contender Is Named After Scandal Topples Macron Ally
2714,New Report on 138 Coronavirus Cases Reveals Disturbing Details
2715,"New U.S. Travel Ban Shuts Door on Africa’s Biggest Economy, Nigeria"
2716,New Unexplained Cases Reported in Oregon and California
2717,New York Appeals Court Strikes Down Fantasy Sports Law
2718,New York Attorney General Accuses N.Y.C. of Fraud Over Taxi Crisis
2719,New York City Eyes First Suspected Case of Coronavirus
2720,New York City May Crack Down on Grubhub and Other Food Delivery Apps
2721,New York Times Leads Polk Awards With 4 Prizes
2722,New York to Sue Trump Administration Over Global Entry Freeze
2723,"New Yorkers Face a Training Gap for Tech Jobs, but a Study Finds Hope"
2724,New in Paperback: ‘Bad Blood’ and ‘Lost Children Archive’
2725,New in Paperback: ‘Say Nothing’ and ‘The Club’
2726,New in Paperback: ‘Spies of No Country’ and ‘Daisy Jones & the Six’
2727,New in Paperback: ‘Survival Math’ and ‘Black Leopard Red Wolf’
2728,New poll shows Sanders opening big lead in California.
2729,New results in from Iowa. Same leaders.
2730,"Newsletter Readers, How Can We Improve?"
2731,Nick Taylor Pulls Away From Mickelson to Win at Pebble Beach
2732,Nicolas Moufarrege Was a Student of Art History. This Work Shows It.
2733,Nigeria Responds to First Coronavirus Case in Sub-Saharan Africa
2734,Nigeria to Address Security Issues That Led to Visa Restrictions
2735,"Nigeria ‘Blindsided’ by Trump Travel Ban, Its Top Diplomat Says"
2736,"Nigeria ‘Blindsided’ by Trump Travel Ban, Its Top Diplomat Says"
2737,Nigerians in New York Worry Expanded Travel Ban Will Hurt Family Ties
2738,"Nikita Pearl Waligwa, Star of ‘Queen of Katwe,’ Dies at 15"
2739,Nissan Sues Carlos Ghosn for $90 Million
2740,"Niños sirios mueren congelados, caen bombas y ‘a nadie le importa’"
2741,No Budget for a Custom Kitchen? No Problem
2742,"No Corrections: Feb. 10, 2020"
2743,"No Corrections: Feb. 18, 2020"
2744,"No Corrections: Feb. 24, 2020"
2745,"No Corrections: Feb. 3, 2020"
2746,"No Corrections: February 17, 2020"
2747,"No Evidence That Pets Can Get Covid-19, but Wash Your Hands Anyway"
2748,No Witnesses
2749,"No longer ‘chained’ to Senate desk, Klobuchar says she’s ‘surging’ in New Hampshire."
2750,No time for a full selfie line as Yang races across New Hampshire.
2751,"No, Not Sanders, Not Ever"
2752,"No, President Trump: You’ve Weakened America’s Soft Power"
2753,Noah Davis Is Gone; His Paintings Continue to Hypnotize
2754,"Noah Mamis, Jason Ziplow"
2755,Nobody Messes With the Jesus (Except for John Turturro)
2756,North Dakota Tribes Score Key Voting Rights Victory
2757,"North Korea’s Internet Use Surges, Thwarting Sanctions and Fueling Theft"
2758,Nothing Says ‘I Love You’ Like Secondhand Roses
2759,Notre-Dame’s Crypt and Square May Reopen in Spring
2760,"Novak Djokovic Wins Australian Open, Tightens Grand Slam Race"
2761,Now Weinstein Faces Charges He Raped a Woman at a Beverly Hills Hotel
2762,"Now, African-American voters get their say."
2763,Number Theory
2764,"Number of Homeless Students Rises to New High, Report Says"
2765,OPEC Scrambles to React to Falling Oil Demand From China
2766,Obama denounces a Republican super PAC’s deceptive anti-Biden ad.
2767,Ocasio-Cortez Builds Progressive Campaign Arm to Challenge Democrats
2768,Ocasio-Cortez Builds Progressive Campaign Arm to Challenge Democrats
2769,Ocasio-Cortez and the Strokes turn out for Bernie Sanders.
2770,"Officer Pointed Gun at Black College Student’s Head, Lawsuit Says"
2771,"Oh, Does Another State Also Vote Early? New Hampshire Isn’t Listening"
2772,Oil Industry Tool to Spare Polar Bears Is More Miss Than Hit
2773,Oil and Gas May Be a Far Bigger Climate Threat Than We Knew
2774,Oklahoma Botched 2 Executions. It Says It’s Ready to Try Again.
2775,Oklahoma’s Tribes Unite Against a Common Foe: Their Cherokee Governor
2776,Okwui Okpokwasili Wants You to Slow Down and Walk With Her
2777,"Olympic Trials Marathon: ‘We Wanted to Give a Party, and Everybody Is Coming’"
2778,Omega and James Bond Mark 25 Years
2779,"On Broadway, the Art of Adornment"
2780,"On Capitol Hill, questions about the caucus system."
2781,"On College Campuses, Social Media Provides Private Spaces for Thousands"
2782,On Politics: A Boost for Biden
2783,On Politics: Acquitted. What’s Next?
2784,On Politics: Bloomberg Under the Microscope
2785,On Politics: Bloomberg’s in the Debate
2786,On Politics: Can Bloomberg Take the Heat?
2787,On Politics: Hanging-Chad Flashbacks
2788,On Politics: Iowa 2.0?
2789,On Politics: Iowa Caucus Edition!
2790,On Politics: Is Warren Back in It?
2791,On Politics: Last Debate Before Super Tuesday
2792,On Politics: New Hampshire Buzz
2793,On Politics: Still Talking About Iowa
2794,On Politics: The Uncertainty Continues
2795,On Politics: This Is Sparta (or Manchester)
2796,On Politics: Watch Where Sanders Goes
2797,On Politics: We Could Be Here Awhile
2798,On Politics: Where Things Stand Before South Carolina
2799,"On Politics: Your Turn, Nevada"
2800,"On Roofs or in Basements, a New Way to Ice Skate"
2801,"On This Valentine’s Day, See What Love Is"
2802,"On Tour, Pompeo Courts Africa, to Counter China"
2803,On Trump’s To-Do List: Take Back The Suburbs. Court Black Voters. Expand the Electoral Map. Win.
2804,"On Valentine’s Day, This One Goes Out to All the Lovers"
2805,On the Trail of America’s First Women to Vote
2806,On-Demand Webinar: Teach Argumentative Writing With Our Student Editorial Contest
2807,On-Demand Webinar: Writing Arguments With Help From Nicholas Kristof and the Times Op-Ed Page
2808,"Once Skeptical, Senate Republicans Are All In on Trump"
2809,One Guaranteed Winner in the Democratic Primary: Plans to Tax the Rich
2810,"One Pot, One Meal: Curating a Special Set of Simple Recipes"
2811,One Side of a Nuclear Waste Fight: Trump. The Other: His Administration.
2812,One St. Patrick’s Day Parade in New York Still Bans L.G.B.T. Groups
2813,One Tiny Beautiful Thing
2814,One day to go.
2815,One image from the day after the Iowa caucuses.
2816,"One shot, and a knockout."
2817,OneWeb Launches 34 Satellites as Astronomers Fear Radio Chatter
2818,Only 17% of Democrats think Iowa should remain first.
2819,Only Doctors Can Save the Markets From the Coronavirus
2820,Open primaries let voters meddle (at their own risk).
2821,"Operas About Strife, Strength and Survival"
2822,Optimism
2823,Oregon Republicans Disappear for Another Climate Vote
2824,Oregon Women Rout UConn at Home: ‘They’re Just Too Good’
2825,"Organizers of France’s Oscars Resign, 2 Weeks Before Ceremony"
2826,"Orson Bean, Free-Spirited Actor of Stage and Screen, Dies at 91"
2827,Oscar Triumph for ‘Parasite’ Reflects Academy’s Evolving Identity
2828,Oscar Winners 2020: The Complete List
2829,Oscar for ‘Parasite’ Quenches Koreans’ Long Thirst for Recognition
2830,"Oscars 2020 Predictions: Who Will Win Best Picture, Actor and Actress"
2831,Oscars 2020: Highlights From a History-Making Night
2832,Otro triunfo latino
2833,"Our Ancestors Were Sold to Save Georgetown. ‘$400,000 Is Not Going to Do It.’"
2834,"Our Best Valentine’s Day Recipes: Lobster, Steak, Chocolate and More"
2835,Our Latest Crush
2836,Ousted Cooper Hewitt Director Calls Investigation a ‘Sham’
2837,Out of Prison but Still Not Free
2838,Outbreak in Northern Italy Poses National Challenge
2839,Over the Falls
2840,"Overlooked No More: Andrée Blouin, Voice for Independence in Africa"
2841,"Overlooked No More: Joseph Bartholomew, Golf Course Architect"
2842,"Overlooked No More: Valaida Snow, Charismatic ‘Queen of the Trumpet’"
2843,"Owen Bieber, Auto Workers’ President During Period of Decline, Dies at 90"
2844,Own the Recipes of Georgia O’Keeffe
2845,"P.S.G. President, Nasser al-Khelaifi, Is Charged in Soccer Scheme"
2846,"PG&E Has a Survival Plan, and Newsom Has Plan B: A Takeover"
2847,"Pacific Palisades, Los Angeles: Where Mountains Meet the Sea"
2848,Packing for Off-Season City Getaways
2849,Paging Michael Bloomberg
2850,Palestinian Leader Denounces Trump’s Mideast Plan at U.N.
2851,Pamela Adlon Fuels Her Hectic Life With Fosse and ‘Fame’
2852,Pangolins Are Suspected as a Potential Coronavirus Host
2853,"Para una ciudad encerrada, la esperanza llega en motocicleta"
2854,"Paraguay’s Response to Modernist Architecture? Clay, Mud and Timber"
2855,Pardon Closes the Book on Michael Milken’s Case but Can’t Rewrite It
2856,"Park Hill, Yonkers, N.Y.: A ‘Secret Neighborhood’ Overlooking the Bronx"
2857,"Park Hill, Yonkers, N.Y.: A ‘Secret Neighborhood’ a Half-Mile From the Bronx"
2858,Partial caucus results provided a little (only a little) clarity.
2859,Party People and Twisted Sisters
2860,"Passenger Plane Drew Fire in Syria, Russia Says"
2861,Passengers Begin Disembarking Infected Cruise Ship
2862,"Past Remarks Are Challenging for Bloomberg, and Fair Game for Rivals"
2863,Pat and Anna Cleveland Pile on Spring Fashions
2864,Patrick Mahomes Takes Charge Again
2865,Patrick has high expectations and a plan to go on.
2866,"Paul Farnes, Last R.A.F. Ace of Battle of Britain, Dies at 101"
2867,"Paula Kelly, Who Danced From Stage Onto the Screen, Dies at 77"
2868,Payout From a National Opioids Settlement Won’t Be as Big as Hoped
2869,Pearls Are Forever
2870,Pelosi Clashes With Facebook and Twitter Over Video Posted by Trump
2871,Pelosi Says Democrats Have ‘Pulled Back a Veil’ on Trump’s ‘Unacceptable’ Behavior
2872,Pelosi says she is ‘comfortable’ with Sanders as a potential nominee.
2873,"Pelosi, Trying to Save House Majority, Fends Off Angst Over Sanders"
2874,Pence Will Control All Coronavirus Messaging From Health Officials
2875,"Pennsylvania Diocese, Facing More Abuse Claims, Files for Bankruptcy"
2876,Personal Data of All 6.5 Million Israeli Voters Is Exposed
2877,"Pessimistic Outlook in Russia Slows Investment, and the Economy"
2878,"Pessimistic Outlook in Russia Slows Investment, and the Economy"
2879,Pete Buttigieg Hoped to Win Over Voters of Color. It Still Hasn’t Happened.
2880,"Pete Buttigieg answers French reporter’s question, in French."
2881,Pete Buttigieg calls himself ‘the momentum candidate.’
2882,Pete Buttigieg holds slimmest lead over Bernie Sanders with 97% of Iowa caucuses reporting results.
2883,Pete Buttigieg is ahead of Bernie Sanders in latest New Hampshire poll.
2884,Pete Buttigieg recalls Keene civil rights hero to acknowledge Black History Month
2885,Pete Buttigieg says he will ‘stun the world’ on Super Tuesday.
2886,Pete Buttigieg says he’s ‘one day away from victory.’
2887,Pete Buttigieg to meet with President Jimmy Carter on Sunday.
2888,Pete Buttigieg tries out being human.
2889,Pete Buttigieg vs. Amy Klobuchar: An Abridged History of Midwestern Iciness
2890,"Pete Buttigieg, Coronavirus, Tesla: Your Wednesday Briefing"
2891,Pete Buttigieg’s Dash for Cash: 10 Fund-Raisers in Two Weeks
2892,Pete Davidson’s New Special Seems Like It Could Use a Hug
2893,Pete Rose Has Done His Time
2894,"Peter Serkin, 72, Dies; Pianist With Pedigree Who Forged a New Path"
2895,Petros Ananyan upset Subriel Matias to open the preliminary TV fights.
2896,"Pets Are Just ‘Property,’ So Owners Can’t Do Much When Vets Harm Them"
2897,"Phil Murphy, New Jersey Governor, Says He Has a Kidney Tumor"
2898,"Philanderers, Predators and Pickup Artists: A History"
2899,"Philip Leder, Who Helped Decipher the Genetic Code, Dies at 85"
2900,"Philippines Moves to Shut ABS-CBN, Its Leading Broadcast Network"
2901,"Philippines Moves to Shut ABS-CBN, Its Leading Broadcast Network"
2902,Philippines Reports First Coronavirus Death Outside China
2903,Philippines Reports First Death Outside China as Toll Passes 300
2904,Philippines Tells U.S. It Will End Military Cooperation Deal
2905,Photo: Bernie Sanders high fives tiny supporter.
2906,Photo: Bloomberg has a canine constituency.
2907,Photo: Jacket activism at Biden rally.
2908,Photos From America’s Longest War
2909,Photos of Trump’s Trip to India
2910,Picturing Chaos at the Iowa Caucuses
2911,Pier 1 Imports Files for Bankruptcy and Seeks a Buyer
2912,"Pier 1 Imports, the Struggling Home Goods Retailer, Files for Bankruptcy"
2913,"Piled Bodies, Overflowing Morgues: Inside America’s Autopsy Crisis"
2914,Pipeline Protests Cause Widespread Travel Delays Across Canada
2915,Pirate Plunder
2916,"Plane Skids Off Runway in Istanbul, Breaking Apart and Killing 3"
2917,Plans for Alabama’s Deadly Prisons ‘Won’t Fix the Horrors’
2918,Plant-Based Meat Has Roots in the 1970s
2919,Planting Trees Won’t Save the World
2920,Players’ Union Pushes Back on M.L.B.’s Portrayal of Astros Investigation
2921,Playing on Kansas City Radio: Russian Propaganda
2922,Plymouth Rock and Other Landmarks Are Vandalized in Massachusetts
