,headline
0,$1 Million Homes in California
1,"$1.3 Million Homes in South Carolina, Colorado and Oregon"
2,$2 Million Homes in California
3,"$2.3 Million Homes in California, North Carolina and Massachusetts"
4,$2.6 Million for Puerto Rico’s Pension Fund Went to Hackers Instead
5,$3.5 Million Homes in California
6,"$350,000 Homes in Connecticut, Michigan and Texas"
7,"$550,000 Homes in New Jersey, Maine and Tennessee"
8,"$750,000 Homes in California"
9,"$9 Cabbages, Emergency Pork: Coronavirus Tests China on Food"
10,1 Dead and 5 Injured After Shooting on Greyhound Bus in California
11,1 in 5 Mothers Gets Postpartum Depression. New York City Plans to Help.
12,"1,000 Workers, Go Home: Companies Act to Ward Off Coronavirus"
13,10 New Books We Recommend This Week
14,10 New Books We Recommend This Week
15,10 Spring Accessories Adorned With Chains
16,100 of Our Best Chocolate Recipes
17,11 New Books We Recommend This Week
18,11 New Books We Recommend This Week
19,12 Art Exhibitions to View in N.Y.C. This Weekend
20,12 Plays and Musicals to Go to in N.Y.C. This Weekend
21,12 Plays and Musicals to Go to in N.Y.C. This Weekend
22,"12 Pop, Rock and Jazz Concerts to Check Out in N.Y.C. This Weekend"
23,"12 Pop, Rock and Jazz Concerts to Check Out in N.Y.C. This Weekend"
24,"12 Pop, Rock and Jazz Concerts to Check Out in N.Y.C. This Weekend"
25,"12 Pop, Rock and Jazz Concerts to Check Out in N.Y.C. This Weekend"
26,"125 Years Later, Native American Tribe in Montana Gets Federal Recognition"
27,13 New Books to Watch For in March
28,13 Plays and Musicals to Go to in N.Y.C. This Weekend
29,130 New Prompts for Argumentative Writing
30,14 Art Exhibitions to View in N.Y.C. This Weekend
31,"14 Die and Hundreds Sickened in Pakistan, and the Cause Is a Mystery"
32,14 Plays and Musicals to Go to in N.Y.C. This Weekend
33,15 million voters in California are receiving their mail-in ballots this week.
34,16-Year-Old Pleads Guilty to Murder in Colorado School Shooting
35,160 Nations Ban These Weapons. The U.S. Now Embraces Them.
36,"17 Works, 9 Hours, 10 Days: My Beethoven Quartet Marathon"
37,18 Great Chili Recipes for Chilly Days
38,"1920: Britain, Italy and Japan Recognized Soviet Russia"
39,"2 Americans, 19 and 20, Go on Trial Over Killing of Italian Police Officer"
40,2 Dead After Sydney to Melbourne Train Derails in Australia
41,"2 Ob-Gyns, on Pelvic Exams and Patients’ Consent"
42,"2 Police Officers Injured in Shooting at Walmart in Arkansas, Officials Say"
43,2 Tax Strategies to Consider Ahead of the 2020 Election
44,20 Art Exhibitions to View in N.Y.C. This Weekend
45,"2020 Campaign, China, the Oscars: Your Weekend Briefing"
46,"2020 Debate, Coronavirus, Ben Affleck: Your Wednesday Evening Briefing"
47,2020 Democratic Debate: Highlights From Nevada
48,2020 Democrats fan out across the country.
49,2020 Oscars Broadcast Hits a New Ratings Low
50,2020 Oscars Red Carpet: Live Updates
51,"2020 Super Bowl Commercials: Funeral for Mr. Peanut, Tears for Google"
52,21 Art Exhibitions to View in N.Y.C. This Weekend
53,24 Tense Hours in Abraham Lincoln’s Life
54,3 Democratic presidential candidates are in Washington on the day of the Iowa caucuses.
55,3 Former Barclays Executives Are Cleared of Fraud Charges
56,3 Simple Things You Can Do Today to Improve Your Finances
57,3 Steps to a Socially Conscious Portfolio
58,3 Ways to Retrain Your Mind to Get Out of Credit Card Debt
59,"3,500 Women, 6 Continents and a Year of Riding High"
60,"31 Reported Dead in Mali, as Attackers Return to Scene of a Massacre"
61,36 Hours in Basel
62,36 Hours in Curaçao
63,36 Hours in Niseko
64,"36 Hours in Queenstown, New Zealand"
65,4 Film Series to Catch in N.Y.C. This Weekend
66,4 Film Series to Catch in N.Y.C. This Weekend
67,"4 Takeaways From the Democratic Debate, Gender Edition"
68,4 Takeaways From the U.S. Deal With the Taliban
69,5 Big Myths About Money and Parenting
70,5 Cheap (ish) Things to Organize Your Desk
71,5 Cheap(ish) Things to Make the Perfect Cup of Coffee
72,5 Classical Music Concerts to See in N.Y.C. This Weekend
73,5 Comedy Shows to Catch in N.Y.C. This Weekend
74,5 Dance Performances to See in N.Y.C. This Weekend
75,5 Film Series to Catch in N.Y.C. This Weekend
76,5 Film Series to Catch in N.Y.C. This Weekend
77,5 Killed in Shooting at Molson Coors in Milwaukee
78,5 New Standout Hotels in Los Angeles
79,5 New Standout Resorts in the Caribbean
80,5 Takeaways From Trump’s Impeachment Trial
81,5 Takeaways From the Nevada Caucuses (The Big One: Sanders Takes Control)
82,5 Takeaways From the New Hampshire Primary
83,5 Takeaways From the Weinstein Verdict
84,5 Takeaways From the Weinstein Verdict
85,50 States of Love
86,50 States of Love: Readers Respond
87,"50 States, 50 Love Stories"
88,52 Books for 52 Places
89,"6 Children and Mother Die in Mississippi Fire, Officials Say"
90,6 Classical Music Concerts to See in N.Y.C. This Weekend
91,6 Classical Music Concerts to See in N.Y.C. This Weekend
92,6 Classical Music Concerts to See in N.Y.C. This Weekend
93,6 Comedy Shows to Catch in N.Y.C. This Weekend
94,6 Comedy Shows to Catch in N.Y.C. This Weekend
95,6 Comedy Shows to Catch in N.Y.C. This Weekend
96,6 Cooper Hewitt Trustees Resign After Director’s Removal
97,6 Dance Performances to See in N.Y.C. This Weekend
98,6 Emerging Designers to Know This Fashion Month
99,6 Takeaways From the Democratic Debate in Nevada
100,6 Takeaways From the Democratic Debate in South Carolina
101,6-Year-Old Held in Mental Health Center for 2 Days Without Mother’s Consent
102,7 Dance Performances to See in N.Y.C. This Weekend
103,7 Dance Performances to See in N.Y.C. This Weekend
104,7 Essential Books About Pandemics
105,7 Great Historical Y.A. Novels
106,7 Takeaways From the Democratic Debate in New Hampshire
107,7 Things to Do With Your Kids in N.Y.C. This Weekend
108,8 Things to Do With Your Kids in N.Y.C. This Weekend
109,8 Things to Do With Your Kids in N.Y.C. This Weekend
110,8 Things to Do With Your Kids in N.Y.C. This Weekend
111,92% of precincts now in.
112,A $4 Million NICU Bill: The Price of Prematurity
113,A 2020 Democratic Primary Endorsement Digest
114,A 42-Year-Old Zamboni Driver Wins in His N.H.L. Debut
115,A 42-Year-Old Zamboni Driver Wins in His N.H.L. Debut
116,A Ballerina’s Nightmare: ‘Am I More Than Just a Dancer?’
117,A Beethoven Aria Was Lost. I Filled In the Missing Pages.
118,A Beloved Neighbor Leaves the Building
119,"A Beloved Philanthropist, a Grisly Murder and a Neighborhood in Shock"
120,A Billion-Dollar Scandal Turns the ‘King of Manuscripts’ Into the ‘Madoff of France’
121,A Bittersweet Homecoming for Egypt’s Jews
122,A BlackBerry Brought D’Angelo Russell to Minnesota
123,A Bond Theme Suits Billie Eilish Quite Well
124,A Book Club Without Required Reading (or the Cheese Spread)
125,"A Book So Far Ahead of Its Time, It Took 87 Years to Find a Publisher"
126,A Brand That Keeps Trying for Cool
127,"A Brazen Gunman, 2 N.Y.P.D. Officers Shot and the Fallout"
128,"A Bryant collaborator was invited as a guest. Instead, he’s taking photos."
129,A Call to High School Letter Writers
130,"A Canadian Multimillionaire, a Caribbean Feud and an International Rape Case"
131,A Cancer Patient Stole Groceries Worth $109.63. She Was Sentenced to 10 Months.
132,A Case for Clemency
133,A Case for Paying With Your Phone
134,"A Cellist’s Tragic Tale, Told in Dance"
135,A Champagne Wish Comes True
136,A Chef Who Brings Fashion to the Kitchen
137,"A Childhood Crush, Updated for the 21st Century"
138,A Comic Coming-of-Age Novel Laced With Social Commentary
139,A Complicated Friendship
140,"A Composer Puts Her Life in Music, Beyond Labels"
141,A Connection Before the Coffee Was Cold
142,"A Criminal Underworld of Child Abuse, Part 1"
143,"A Criminal Underworld of Child Abuse, Part 1"
144,"A Criminal Underworld of Child Abuse, Part 2"
145,A Daily Aspirin for Pregnancy?
146,A Day to Remember Kobe Bryant
147,"A Deadly Storm, a Witch Hunt and a Village Without Men"
148,A Debate? The Democrats’ Slugfest in South Carolina
149,A Democratic Piñata Party
150,A Democratic President Cannot Undo All of Trump’s Damage in 100 Days
151,"A Des Moines county precinct leader called, texted and continues to wait for the results to be reported."
152,A Designer Who Wants to Make Your Future Heirlooms
153,A Devastating (and Darkly Hilarious) New Novel From the ‘Westworld’ Writer Charles Yu
154,A Disaster Video That Finally Tells the Truth About Climate Change
155,A Dishonorable Senate
156,A Dozen Calls to Child Abuse Hotline Did Not Save 8-Year-Old Boy
157,A Driverless Oscars Takes a Winding Road
158,"A Fake Pharmacist, 745,000 Prescriptions and a $7.5 Million Settlement"
159,A Famous Photograph
160,A Farmhouse Fantasy Tucked in the Woods of Upstate New York
161,A Feminist Cookbook Meant to Inspire Fuels Outrage Instead
162,A Food Cart Worker’s Biggest Job: Defending Vendor Rights
163,A Food Conference Heads to Pittsburgh
164,A Former F.B.I. Negotiator and His Tips for Travel
165,A Former Owner of Newsweek Pleads Guilty in a Fraud Scheme
166,A Formula for Growth After the Start-Up Stage
167,A Frank Lloyd Wright Design Will Have a New Life in London
168,A Free and Fair Presidential Election Is Venezuela’s Way Forward
169,A French Revolution in New York: Indoor Soccer
170,A German Mine Hit and the Ship Split in Half
171,A Giant Milk Industry Merger Moves Closer With a $425 Million Deal
172,A Giant Swing. Jungle Screaming. Ice Plunges. You’ll Love It.
173,A Graphic Novel Remembers Attica
174,"A Grim Landmark as Official Death Toll in China Tops 1,000"
175,A Grinch Steals a Bank and Fires an Angel
176,A Growing Presence on the Farm: Robots
177,A Grown-Up Bed That Will Last for Years
178,"A Guide to Super Bowl LIV: Start Time, Odds, Halftime and More"
179,A Gun Shop and a Family Prone to Breakdowns: What Could Go Wrong?
180,A Hallowed French Company Takes on ‘Angels in America’
181,A Hint of Freedom for a Turkish Activist. Then Back to Jail.
182,A History of Seduction
183,A Hockey Globetrotter Finds Her Showcase at Home
184,A Hometown Exhibition Will Showcase August Wilson’s Process
185,"A Horse Has 5 Toes, and Then It Doesn’t"
186,A Hunt for Clues in Hawaii After a Tourist Couple Falls Ill With Coronavirus
187,A Immigrant From Brazil Has Changed Lives as a Coach. Is That Enough to Stay in the U.S.?
188,A Jerky Made of Salmon
189,"A Job Overseas, but Stranded by Coronavirus Travel Bans"
190,A Kayaker and a 134-Foot Waterfall. What Could Go Wrong?
191,A Kenyan Painter Casts a Critical Eye on China’s Role in Africa
192,"A Kobe Bryant Joke Goes Wrong, Revealing Comedy’s Troll Side"
193,"A Latino Worker, a Risky Construction Site and a Family in Mourning"
194,"A Legal Lion Lays Down His Gavel With a Ruling of ‘Love, Not Hate’"
195,A Legless Black Man Comes Into a Windfall in This Biting Satire
196,"A Lesbian Who’s Not a Lesbian Walks Into a Bar, and ..."
197,A List of Trump’s Pardons and Commutations
198,A London ‘Fidelio’ With a German Twist
199,A Love Letter to Old-Fashioned Department Stores
200,A Luxury Apartment Rises in a Poor Neighborhood. What Happens Next?
201,A Meme Girl Mash-Up
202,A Mexican Exodus Is Helping Shrink the Undocumented Population
203,A Mexican Oil Chief’s Hide-Out: Sea Views and 2 Golf Courses
204,A Mexican Police Chief’s Handshake Deal With a Sicario
205,A Mexican Police Chief’s Handshake Deal With a Sicario
206,A Mezcal Master Turns to the Martini
207,A Mini-Mississippi River May Help Save Louisiana’s Vanishing Coast
208,A New Addition to the Cleaning Cohort
209,A New Book Asks: Just How Machiavellian Was Machiavelli?
210,A New Company Vying for Your Dinner Plate
211,"A New Era for the Berlin Film Festival, With Two at the Top"
212,A New Martyr Puts a Face on China’s Deepening Coronavirus Crisis
213,A New Mini-Moon Was Found Orbiting Earth. There Will Be More.
214,A New York Councilman Faces Ethics Charges. For a Third Time.
215,A New York Issue That Unites Landlords and the N.A.A.C.P.
216,A New York Times analysis finds many errors in the Iowa results.
217,"A Noted Musician’s Instrument Was Ruined. Not by Us, Says T.S.A."
218,A Novel That Will Get People Talking
219,A Onetime ‘Refugee Child’ Takes On Austria’s Far Right
220,A Painter Who Wants Art to Shock
221,A Pedophile Writer Is on Trial. So Are the French Elites.
222,A Peek Inside YouTube’s Money Machine
223,"A Pitch for More Editorials, Not Fewer"
224,A Plea to Save the Last Nuclear Arms Treaty
225,A Police Officer’s Word Convicted Them. Now He’s Charged With Murder.
226,A Police State With an Islamist Twist: Inside Hifter’s Libya
227,A Polish Olympian Aimed to Join Team U.S.A. Things Got Ugly.
228,A Possible Strategy for Fending Off Surprise Medical Bills
229,A Premeditated Chance Encounter
230,A Presidency Increasingly Guided by Suspicion and Distrust
231,A Presidential Pardon for the ‘Junk Bond King’
232,A Quartet Sets a New Standard for Beethoven Marathons
233,A Question That Almost Went Unasked
234,A Quiet Respite in a Bustling Open Workplace
235,"A Ramen Diner From a Master in Boerum Hill, Brooklyn"
236,A Rape Suspect Was Released. 3 More Women Were Attacked.
237,A Rare Legal Battle: Can a State Force a City to House Coronavirus Patients?
238,A Rare Trump-Era Climate Policy Hits an Obstacle: The Tax Man
239,"A Real-Life J.F.K. Lover, Murdered in 1964, Stars in Two New Novels"
240,A Reporter Remembers the Miracle on Ice 40 Years Later
241,A Revolutionary Approach to Beethoven: Period Instruments
242,"A Rich, Old-Fashioned Spy Thriller Set in Elizabethan England"
243,A Royal Instagram Mystery
244,A Royal Instagram Mystery
245,A Russian Filmmaker’s Travelogue of Hell
246,A Scholar of Democracy Gets a 2020 Lab for His Ideas
247,A Sculptor of the Female Gaze
248,A Sculptor of the Female Gaze
249,A Shot Before Last Call: Capturing New Orleans’s Vanishing Black Bars
250,A Simple Way to Equalize the Ivies? Give Others the Legacy SAT Bonus
251,A Slice of the Fulton Fish Market Gets A New Life
252,A Solution to the D.N.C.’s Iowa Problem
253,A Spinning Top in ‘Rodeo’
254,A Starring Role on the Wrist
255,"A Steyer supporter gets a birthday surprise, and a ‘Biden man’ sees another candidate’s appeal."
256,"A Store, a Chalet, an Unsealed Pipe: Coronavirus Hot Spots Flare Far From Wuhan"
257,A Stunning St. Lucia Golf Resort Is Really Out of the Way. That’s by Design.
258,A Super Bowl With a Latino Flair in Miami
259,A Supreme Court for the Rich
260,A Survivor Recalls the Charlie Hebdo Massacre and a Long Road to Recovery
261,A TV Star’s Suicide Prompts a Blame Game in Britain
262,A Tempest in a Pizzeria Spills Out Into the Street
263,A Texas Border Town’s Booming Trade in Great Tacos
264,A Thorn in YouTube’s Side Digs In Even Deeper
265,A Timeline of the Coronavirus
266,A Timeline of the Weinstein Case
267,A Titanic Collection Grows
268,A Top L Brands Executive Complained of Harassment. Then She Was Locked Out.
269,A Trillion Trees: How One Idea Triumphed Over Trump’s Climate Denialism
270,A Trump ally has praise for a Trump rival: Michael Bloomberg.
271,A Twist in California’s Homeless Crisis: Evictions by the Evicted
272,A U.S.-Taliban Deal Hinges on Reducing Violence. It Might Work Like This.
273,A Venetian Aperitif Fit for a Spritz
274,A Very Long Night in Iowa
275,A Victory in Court for Pipelines but the Debate Continues
276,A Volleyball Star Who Raps as Kofi
277,A Wall St. Giant Says Sanders Would ‘Ruin’ the Economy
278,A War Without Winners Winds Down
279,A Warren memo describes rivals’ flaws and her path forward.
280,A Warren supporter was told to leave her sign outside. So she improvised.
281,A Water Main Breaks Every Day in the City
282,A Wedding Day That Left Them Shook
283,A Widow Takes Her Grown Kids on a Cruise. What Could Go Wrong?
284,A Winning Baseball Novel by the Editor of The Paris Review
285,A Young Father Was Investigated 4 Times. Then His Newborn Died.
286,"A big crowd for Buttigieg, with more than a few political tourists in the mix."
287,A brief history of brokered conventions.
288,A burst of student volunteers in Las Vegas.
289,A consequential vote is captured in pencil.
290,A couple in Columbia is split between Warren and Sanders.
291,A crowd waits for Warren in Houston: ‘I just love her energy.’
292,A different bus in the parking lot.
293,A front-row seat at Elizabeth Warren’s rally.
294,"A high school becomes a caucus site, and students are running the show."
295,A longtime Democratic activist makes his pick in Columbia.
296,"A major union is not yet endorsing, but its local affiliates may weigh in."
297,A new picture of the Democratic money race.
298,A record number of immigrants are now eligible to vote.
299,A recording of Michael Bloomberg’s defense of stop-and-frisk goes viral.
300,A second national poll gives Sanders a lead over Biden.
301,A second national poll gives Sanders an edge over Biden.
302,A six-person newsroom is an Iowa must-follow.
303,A snapshot of last night in Iowa.
304,A talk-show host questions Klobuchar about a flawed case against a black teenager.
305,A volunteer works through the home stretch.
306,A ‘Disappointed’ Steve Cohen Walks Away From Mets Purchase
307,A ‘Team of Rivals’ for the Democrats?
308,"A. E. Hotchner, Writer and Friend of the Famous, Dies at 102"
309,Aaron Judge and LeBron James Join Chorus of Astros Condemnation
310,Accused Mastermind of Mumbai Attack Convicted of Links to Terrorism
311,"Activate This ‘Bracelet of Silence,’ and Alexa Can’t Eavesdrop"
312,Activist Arrested Over Removal of a Slave Auction Plaque in Charlottesville
313,Actors Walk Out After Roman Polanski Wins Best Director at France’s Oscars
314,Actual Decadence!
315,Ad campaigns are already looking beyond South Carolina.
316,Ad campaigns are already looking to Super Tuesday.
317,Adam Scott Emerges From Crowded Field to Win Genesis Open
318,"Adapting to Rising Seas, Schools Move to the Rafters and Cats Swim"
319,Addiction Memoirs Are a Genre in Recovery
320,Adding Razzle-Dazzle to a Gaucho Dance Style
321,Administration to Divert Billions From Pentagon to Fund Border Wall
322,Admit It: You Don’t Know What Will Happen Next
323,"Adrienne McGill, Brian Adams"
324,"Ads in Spanish, Obama Cameos: The Democratic Ad Race in Nevada and South Carolina"
325,Adèle Haenel : « La France a complètement raté le coche » de #MeToo
326,Adèle Haenel: A Francia ‘se le ha ido el tren’ del #MeToo
327,Adèle Haenel: France ‘Missed the Boat’ on #MeToo
328,"Afghan Votes Will Be Audited, Extending Monthslong Election Crisis"
329,Afghan War Casualty Report: February 2020
330,"Africa, Intertwined With China, Fears Coronavirus Outbreak"
331,"Africa, a Thunder and Lightning Hot Spot, May See Even More Storms"
332,"After 18 Years, Is This Afghan Peace, or Just a Way Out?"
333,"After 7 Weeks of ‘No,’ an Opening in Her Datebook"
334,"After Acquittal, It’s Anything Goes for the Republicans"
335,"After Acquittal, Trump Repeats Inaccurate Claims on Impeachment and Ukraine"
336,"After Acquittal, Trump’s Attacks on Opponents"
337,"After Disasters, Puerto Ricans Are Left With $1.6 Billion in Unpaid Insurance Claims"
338,"After Hitting a ‘Very Dark Spot,’ Angels Are Ready for a Reset"
339,"After Judge’s ‘Troubling’ Behavior, Lawmakers Question Court Misconduct Rules"
340,"After Living as a Woman for Decades, He Staged His Own Gender Reveal"
341,"After Long Wait, The Markup Is Ready to ‘Show Our Work’"
342,"After New Hampshire, Nevada takes center stage for Democrats."
343,"After Officers Are Shot, Police Union Suggests an Enemy: The Mayor"
344,"After Oprah’s Departure, Film About Simmons Accusers Finds New Home"
345,"After Oprah’s Departure, Film About Simmons Accusers Finds New Home"
346,"After Six Years in Office, New York’s Mayor Vows to ‘Save Our City’"
347,"After Six Years in Office, New York’s Mayor Vows to ‘Save Our City’"
348,"After Stone Case, Prosecutors Say They Fear Pressure From Trump"
349,"After Trump Mocks a Sea Wall in New York, Plan Is Abruptly Shelved"
350,"After Trump’s Attacks on Justice Dept., Barr Says He Will Not ‘Be Bullied’"
351,"After a Dozen Deaths, Justice Dept. Investigates Mississippi Prisons"
352,"After a Face-Off in Syria, Turkey and Russia Try to Pull Back From the Brink"
353,"After a day of attacks, Biden turns the focus back to Trump."
354,"After closing arguments, two sides grudgingly greet each other."
355,"After ‘Parasite,’ Are Subtitles Still a One-Inch Barrier for Americans?"
356,"Aging, Rising, Brainy, Booming: Super Tuesday Economies Pose Wider Test"
357,"Ahead of an expected drubbing, Buttigieg reflects on failure."
358,Aide Accused of Being Anonymous Op-Ed Writer Is Reassigned to Energy Department
359,"Air Travelers Can’t See All of It, but More Tech Is Moving Them Along"
360,"Aircraft, Big and Small, Are Changing Our Relationship With Flight"
361,Airline Flight Delays Got Worse in 2019. Here’s a Scorecard.
362,"Airstrike Hits Turkish Forces in Syria, Raising Fears of Escalation"
363,Al Qaeda Claims It Directed Florida Naval Base Shooting
364,"Alanis Morissette’s Agonized Ballad, and 10 More New Songs"
365,Alaska Tourism Officials See an Opportunity in Coronavirus
366,Alex Ovechkin Scores Goal No. 700 in a Loss to the Devils
367,Alexander Calder Project Planned for Philadelphia
368,"Alfred Portale Writes a Second Act, in Italian"
369,Alice Mayhew Taught Me How to Work With Words
370,"Alice Mayhew, Who Edited a Who’s Who of Writers, Dies at 87"
371,Alicia Keys had called Staples Center ‘the house that Kobe Bryant built.’
372,"All This Dystopia, and for What?"
373,"All Your Favorite Brands, From BSTOEM to ZGGCD"
374,All eyes on turnout.
375,All the Presidents Penned
376,Alligators in the Sewers
377,"Allison Ambrosio, Bryant Conkling"
378,"Along the Great Lakes, It’s Time to Prepare for Extremes"
379,Amazon Confronts Criticism Over ‘Hunters’ and Sale of Nazi Propaganda
380,Amazon Looks to Question Trump in Pentagon Contracting Case
381,"America Dominates Olympic Basketball, but What About ‘3x3’?"
382,America Has Had a Year to Learn How to Say Buttigieg. And Yet.
383,Americans Demand a Rethinking of the ‘Forever War’
384,America’s Parasite
385,"Amid Insults and Interruptions, Sanders Absorbs Burst of Attacks in Debate"
386,Among Those Pressing Trump to Weed Out Disloyalty: Clarence Thomas’s Wife
387,Amsterdam Considers Apology for Slavery in Former Colony
388,Amy Klobuchar Compares ‘Cool Newcomer’ Pete Buttigieg to Trump
389,Amy Klobuchar Is Pressed on ‘The View’ Over Her Record as a Prosecutor
390,Amy Klobuchar appeals to African-Americans at ministers’ breakfast.
391,Amy Klobuchar casts herself as the underdog.
392,Amy Klobuchar greets packed hall after strong debate performance.
393,"Amy Klobuchar tells voters: ‘We are on a surge, as they say.’"
394,Amy Klobuchar thinks she can help Democrats take back the Senate.
395,"Amy Klobuchar, currently in sixth place, says she’s ‘exceeded expectations.’"
396,Amy Klobuchar: ‘What I’ve got is grit.’
397,Amy Klobuchar’s Bipartisan Record Includes Voting for Many Trump Judicial Nominees
398,Amy Klobuchar’s Caucus-Day in Iowa Visit Pays Off
399,"An Adulterer, a Gang Member, a Dystopian Teacher: 3 Novels of American Womanhood"
400,An Afghan Killed 2 Americans. The U.S. Government Issued the Gun.
401,"An Algorithm That Grants Freedom, or Takes It Away"
402,An Alzheimer’s Treatment Fails: ‘We Don’t Have Anything Now’
403,"An American Dies From the Virus in Wuhan, China"
404,An American in a Locked Down Chinese Town: ‘Everyone Here Is So Bored’
405,An Army Doctor’s First Loss of the Vietnam War: The Woman He Loved
406,An Art Fair Gets Extra Sparkle
407,An Artist Who Aspires to Be ‘a Bone in Everyone’s Throat’
408,An Artist Who Collaborates With Her 11-Year-Old Daughter
409,An Artist Who Doesn’t Want to Feed Western Fantasies About Africa
410,An Artist Whose Muse Is Loneliness
411,An Avalanche Almost Killed This Snowboarder. Can He Win Again?
412,An Egyptian’s Arrest Rekindles an Italian Trauma
413,"An ICE Detention Center? You Picked the Wrong Town, Residents Say"
414,An Immigrant From Brazil Has Changed Lives as a Coach. Is That Enough to Stay in the U.S.?
415,An Interrogation Program Worked Out on the Fly
416,An Israeli Political Aide Confided to His Rabbi. He Was Being Recorded.
417,"An Oil Boom, a Missing Body and a Native Woman’s Quest to Find It"
418,"An Oklahoma Man Lost His Son. A Day Later, He Drove Onto a Crowded Sidewalk."
419,An Old and Contested Solution to Boost Reading Scores: Phonics
420,An Opera About Colonialism Shows How History Warps
421,An Orbital Rendezvous Demonstrates a Space Junk Solution
422,An Oscar-winning film capped Monday’s service.
423,An Undocumented Immigrant Has Information About a Murder. What to Do?
424,An Unexpected Hotel Nestled Among the Clubs of Mykonos
425,An Unexpected Path Leads to a Fresh Start
426,An enthusiastic reception for Joe Biden.
427,An overflow crowd comes to Klobuchar’s aid.
428,"And now a word from Kevin Costner, about Buttigieg."
429,"Andrew Friedman, Michael Zuckerman"
430,"Andrew McCabe, Ex-F.B.I. Official, Will Not Be Charged in Lying Case"
431,"Andrew Weatherall, D.J. Who Broke Down Genre Barriers, Dies at 56"
432,Andrew Yang Drops Out: ‘It Is Clear Tonight From the Numbers That We Are Not Going to Win’
433,"Andrew Yang bets big on New Hampshire (and says bettors are betting on him, too)."
434,Andrew Yang doubles down on criticism of Mark Zuckerberg and Facebook.
435,Andrew Yang raised $6.7 million in January.
436,Andrew Yang says U.S. needs a president that ‘understands technology.’
437,Andrew Yang says U.S. needs a president who ‘understands technology.’
438,Andrew Yang’s Campaign Is Riding on New Hampshire
