,headline
838,C.D.C. Confirms First Possible Community Transmission of Coronavirus in U.S.
839,C.D.C. Confirms First Possible Community Transmission of Coronavirus in U.S.
840,C.D.C. Officials Warn of Coronavirus Outbreaks in the U.S.
841,C.D.C. Officials Warn of Coronavirus Outbreaks in the U.S.
842,C.D.C. and W.H.O. Offers to Help China Have Been Ignored for Weeks
843,CNN cancels show after Buttigieg campaign complains that new poll excluded candidate in at least one call.
844,Cabdrivers Like Me Don’t Want Charity. We Want Justice.
845,"Calculating Air Pollution’s Death Toll, Across State Lines"
846,California Governor Declares Homeless Crisis ‘a Disgrace’
847,California Plans to Apologize to Japanese-Americans Over Internment
848,California Takes Revenge on Trump
849,Cambodia’s Coronavirus Complacency May Exact a Global Toll
850,Can Cities Save America?
851,Can Corporations Stop Climate Change?
852,Can David Ross Bring the Magic of 2016 Back to the Cubs?
853,Can Democrats Beat Trump in Iowa in November?
854,Can Hearing Aids Help Prevent Dementia?
855,Can I Pay Less Rent if My Roommates Are Slobs?
856,Can Iowa’s Democrats Rebound From the Caucus Fiasco?
857,Can Justin Bieber Hide in Plain Sight?
858,Can Players’ Bosses Control Cheating in Baseball? ‘It’s Tough’
859,Can Puppets Save the World From Extinction?
860,Can South Carolina really change everything?
861,Can Trump Tell the Justice Department To Do Whatever He Wants?
862,Can We Please Just Blame the Virus?
863,Can a Lame Duck Mayor Get New Yorkers to Believe in Him Again?
864,Can the Housing Crisis Be Solved?
865,Can the King of Ultrarunning Conquer a Race as Short as the Marathon?
866,Can the Military Fix Base Housing?
867,Can the Sundance Film Festival Stage an Oscar Comeback?
868,Can the World’s Strangest Mammal Survive?
869,Canada Beats Costa Rica to Claim Olympic Soccer Berth
870,Canada Oil-Sands Plan Collapses Over Politics and Economics
871,Canada’s Newest Tyrannosaur Is Named for a ‘Reaper of Death’
872,"Canadian Police Move Against Pipeline Blockades, Arresting Dozens"
873,"Candidates attend trial in Washington, with an eye on Iowa."
874,"Candidates ended Monday with rallies, concerts and handshakes."
875,Candidates make their case with new ads (and merchandise).
876,Canned Artichokes Deserve Your Respect
877,Caramelized! Shallot! Pasta!
878,Caring for Two Generations Almost Cost Me My Career
879,"Carla Gugino Has Range, From ‘Spy Kids’ to Experimental Theater"
880,Carlos Ghosn Was Too Big Not to Fail in Japan
881,"Caroline Flack, Who Hosted ‘Love Island,’ Dies by Suicide at 40"
882,"Cases Soar in Italy, Iran and South Korea as Alarm Grows"
883,"Casper, the Mattress Start-Up, Goes Through With Lackluster I.P.O."
884,"Casper, the Mattress Start-Up, Goes Through With Lackluster I.P.O."
885,Catch up on today.
886,"Catherine Pugh, Former Baltimore Mayor, Is Sentenced to 3 Years in Book Fraud"
887,"Caucus time arrived, but no people did."
888,Caucuses vs. Primaries: Why New Hampshire Won’t Be Like Iowa
889,"Celebrated Abroad, Juan Guaidó Faces Critical Test in Venezuela"
890,"Celine Dion, a Consummate Professional, With Winks Galore"
891,Cellphone Carriers Face $200 Million Fine for Not Protecting Location Data
892,Center Stage at Disney After a Career Out of the Spotlight
893,Central Park Races to Save a Rare Duck Gagging on a Piece of Plastic
894,Centrist Democrats Want to Stop Sanders. They’re Not Sure Who Can.
895,Chairman Mao and Coronavirus
896,Champán en medio de la crisis
897,Change How We Elect the President?
898,Charges to Be Dropped Against Ex-Doctor and Girlfriend in California Assault Case
899,"Charles Fuller Never Expected Broadway. At 80, He’s Arrived."
900,"Charles Hobson, Who Helped Break a TV Color Line, Dies at 83"
901,Charles Lloyd Revels in the Flow on a Stellar Live Album
902,"Charles Murray Returns, Nodding to Caution but Still Courting Controversy"
903,"Charles O’Brien, 86, Who Was Dogged by Hoffa Case, Is Dead"
904,"Charles Portis, Elusive Author of ‘True Grit,’ Dies at 86"
905,Charter Schools in Surprise Political Fight as Trump and Democrats Turn Away
906,Chasten Buttigieg finds fans on the rope line.
907,"Cheer Up, Democrats"
908,Cheers for Mitt Romney in New Hampshire.
909,"Chelsea Sullivan, John Leddy"
910,"Chiara Campana, Cameron Kemal"
911,Chief Justice’s Impeachment Handbook: Determined Minimalism
912,Chiefs Defeat 49ers in Stunning Super Bowl Comeback
913,Chiefs Defeat 49ers in Stunning Super Bowl Comeback
914,Chiefs Finally Win One. Brady and Belichick Appear Primed for a Rematch.
915,Child-Welfare Activists Attack Facebook Over Encryption Plans
916,China Begins Testing an Antiviral Drug in Coronavirus Patients
917,China Clamps Down on Coronavirus Coverage as Cases Surge
918,China Cuts Tariffs on $75 Billion in U.S. Goods. That Was the Easy Part.
919,China Detains Activist Who Accused Xi of Coronavirus Cover-Up
920,China Expands Chaotic Dragnet in Coronavirus Crackdown
921,China Expels 3 Wall Street Journal Reporters as Media Relations Sour
922,China Increasingly Walled Off as Countries Seek to Stem Coronavirus
923,China Is Tracking Travelers From Hubei
924,China Ousts 2 Party Officials Amid Outrage About Coronavirus Response
925,China Pledged to Build a New Hospital in 10 Days. It’s Close.
926,China Sentences Hong Kong Bookseller Gui Minhai to 10 Years in Prison
927,China Sentences Hong Kong Bookseller to 10 Years in Prison
928,"China Spins Coronavirus Crisis, Hailing Itself as a Global Leader"
929,China Stocks Plunge as Coronavirus Fears Grow
930,China Tightens Wuhan Lockdown in ‘Wartime’ Battle With Coronavirus
931,China and America Can Compete and Coexist
932,China recurre a un control social al estilo de Mao para frenar el coronavirus
933,"China, Desperate to Stop Coronavirus, Turns Neighbor Against Neighbor"
934,"China’s Ban on Wildlife Trade a Big Step, but Has Loopholes, Conservationists Say"
935,"China’s Doctors, Fighting the Coronavirus, Beg for Masks"
936,"China’s Dominance of 5G Networks Puts U.S. Economic Future at Stake, Barr Warns"
937,China’s Lavish Funds Lured U.S. Scientists. What Did It Get in Return?
938,China’s Lavish Scientific Funds Fall Into Prosecutors’ Spotlight
939,"China’s Leader, Under Fire, Says He Led Coronavirus Fight Early On"
940,China’s Rover Finds Layers of Surprise Under Moon’s Far Side
941,Chinese Car Factories Idled by Virus Raise Risks to Global Growth
942,"Chinese Doctor, Silenced After Warning of Outbreak, Dies From Coronavirus"
943,"Chinese Doctor, Silenced After Warning of Outbreak, Dies From Coronavirus"
944,Chinese Hacking Is Alarming. So Are Data Brokers.
945,Chinese Students Abroad: How Are You Affected by the Coronavirus Outbreak?
946,Chintan Pandya and Nick Anderer Cook at De Gustibus
947,Chocolate Chip Cookies for Everyone
948,Chocolate Mousse on the Move
949,Chris Matthews Apologizes to Bernie Sanders for Remarks on Nevada Win
950,Christian Louboutin Explains Himself
951,"Christiana Gavis, Jeffrey Hall"
952,"Christina Koch Lands on Earth, and Crosses a Threshold for Women in Space"
953,Cinco puntos clave del veredicto de Harvey Weinstein
954,"Citing Ballot Tampering, Malawi Court Voids Presidential Election"
955,"City Ballet Review: History, Rarity and an Odd, Fascinating Solo"
956,Civil rights leader greets admirers.
957,"Claire Bretécher, Satirical French Cartoonist, Dies at 79"
958,Class War at the Oscars
959,"Claudia Leon, Becca Loftis"
960,"Claudia Rankine Looks at White Privilege From 35,000 Feet"
961,"Claudia Rankine Looks at White Privilege From 35,000 Feet"
962,"Claudio Bonadio, el juez del legado contradictorio"
963,"Clayton Williams, Oilman Whose Gaffes Cost an Election, Dies at 88"
964,Clearview’s Facial Recognition App Is Identifying Child Victims of Abuse
965,Clicking Buy on Amazon? It’s Trying to Prevent a Coronavirus Caveat
966,Climate activists confront Pete Buttigieg in New Hampshire.
967,"Clive Cussler, Best-Selling Author and Adventurer, Is Dead at 88"
968,Cloud Computing Is Not the Energy Hog That Had Been Feared
969,"Cobble Hill, Brooklyn: A Village-Like Vibe With Towering Prices"
970,Col. Vindman and the Trumpification of the National Security Council
971,Colin Kaepernick to Release a Memoir and Start a Publishing Company
972,Collect Them All
973,College Football Prospects Actually Signing on Signing Day? That’s So 2017
974,College Football Prospects Actually Signing on Signing Day? That’s So 2017
975,College students will have MTV to thank for ‘memorable’ polling sites.
976,Colleges Invest So ‘What’s the Town Like?’ Gets an Upbeat Answer
977,"Colum McCann Gives Voice to Grieving Fathers, One Israeli and One Palestinian"
978,Colum McCann’s New Novel Makes a Good-Intentioned Collage Out of Real Tragedy
979,Combining Aerobics and Weights Tied to Optimal Weight Control
980,Comedy Returns to the White House Correspondents’ Dinner. Will Trump?
981,Company behind error-ridden Iowa caucus app offers apology.
982,Complete Success
983,Condoms With Extras? No Thanks
984,Condé Nast to Limit the Use of NDAs
985,Confused about the four sets of Iowa results? We got you.
986,Confusion and Contradiction Reign in Iran’s Coronavirus Reporting
987,Confusion on the Border as Appeals Court Rules Against Trump’s ‘Remain in Mexico’ Policy
988,"Congress Cannot Sue to Enforce Subpoenas Defied by Executive Branch, Appeals Court Rules"
989,Congress Is Expected to Pass Anti-Lynching Bill After 120 Years of Failure
990,Congress Moves to Make Lynching a Federal Crime After 120 Years of Failure
991,Connor Jessup of ‘Locke & Key’ Gets His Nails Done
992,Contra el público
993,Cooper Hewitt Chief Was Forced Out After Probe of Her Wedding
994,Cooper Hewitt Director Abruptly Resigns
995,Cooper Hewitt Donor Pulls $5 Million Gift to Protest Director’s Ouster
996,Coping With Kobe Grief: ‘There’s No Giving Advice on This’
997,Coronavirus Adds to Pressure for U.S. Oil Industry
998,Coronavirus Begins to Sap Growth as Europe’s Economy Slows
999,Coronavirus Cases Seemed to Be Leveling Off. Not Anymore.
1000,"Coronavirus Cases in the United States Reach 34, and More Are Expected"
1001,"Coronavirus Cases in the United States Reach 34, and More Are Expected"
1002,Coronavirus Crisis Shows China’s Governance Failure
1003,Coronavirus Diagnosis in California Highlights Testing Flaws
1004,Coronavirus Disrupts Travel Plans Across Asia
1005,Coronavirus Empties European Cities of Chinese Tourists
1006,"Coronavirus Epidemic Keeps Growing, but Spread in China Slows"
1007,"Coronavirus Epidemic Reaches Bleak Milestone, Exceeding SARS Toll"
1008,"Coronavirus Fears Are Driving Interest Rates Down, a Bad Omen for the Economy"
1009,Coronavirus Fears Drive Stocks Down for 6th Day and Into Correction
1010,Coronavirus Fears Reverberate Across Global Economy
1011,Coronavirus Forces Foreign Students in China to Choose: Stay or Go
1012,Coronavirus Infection Found After Cruise Ship Passengers Disperse
1013,Coronavirus Live Updates: First Death Outside Asia Reported in France
1014,"Coronavirus Live Updates: Second Unexplained Case Found in California, As Epidemic Spreads"
1015,Coronavirus Live Updates: Trump Expands Iran Travel Restrictions
1016,Coronavirus Lockdowns Torment an Army of Poor Migrant Workers in China
1017,Coronavirus May Delay Hard-Fought U.S. Trade Wins in China
1018,Coronavirus Nightmare Could Be the End for Europe’s Borderless Dream
1019,Coronavirus Outbreak Deepens Its Toll on Global Business
1020,Coronavirus Outbreak Risks Reviving Stigma for China
1021,"Coronavirus Pummels Wuhan, a City Short of Supplies and Overwhelmed"
1022,Coronavirus Shock Could Push Europe Into a Downturn
1023,Coronavirus Shows the Problem With Trump’s Stock Market Boasting
1024,"Coronavirus Shuts Macau, the World’s Gambling Capital"
1025,Coronavirus Spreads as New Cases Double in South Korea
1026,"Coronavirus Spreads to Soccer’s Schedule, Closing Stadiums and Stranding Teams"
1027,"Coronavirus Spreads to Soccer’s Schedule, Closing Stadiums and Stranding Teams"
1028,"Coronavirus Stalls Milan, Italy’s Economic Engine"
1029,"Coronavirus Test Kits Sent to States Are Flawed, C.D.C. Says"
1030,Coronavirus Tests Limits of Central Bank Firepower
1031,Coronavirus Thwarts Business Travelers Who ‘Need to Be in the Room’
1032,Coronavirus Weakens China’s Powerful Propaganda Machine
1033,Coronavirus Worsens U.S.-China Ties and Bolsters Hawks in Washington
1034,Coronavirus in California: What You Need to Know
1035,Coronavirus in California: What You Need to Know
1036,Coronavirus in California: What to Know
1037,Coronavirus in N.Y.: Growing Anxiety as Doctors Prepare for an Epidemic
1038,Coronavirus in N.Y.: It’s Coming. Should We Panic or Shrug?
1039,"Coronavirus in N.Y.: Without Chinese Tourists, Business Sags"
1040,"Coronavirus in N.Y.: Without Chinese Tourists, Business Sags"
1041,Coronavirus in New York: 2 More Possible Cases in City Are Identified
1042,Coronavirus in New York: What We Know So Far
1043,Coronavirus in New York: the Latest
1044,"Coronavirus in the U.S.: 29 Confirmed Cases, More Tests Underway"
1045,Coronavirus ‘Hits All the Hot Buttons’ for How We Misjudge Risk
1046,"Coronavirus, Bernie Sanders, India: Your Monday Briefing"
1047,"Coronavirus, Bernie Sanders, Mets: Your Thursday Evening Briefing"
1048,"Coronavirus, Brexit, Australian Open: Your Monday Briefing"
1049,"Coronavirus, Britain, William Barr: Your Friday Briefing"
1050,"Coronavirus, Democratic Debate, Sabrina Ionescu: Your Tuesday Evening Briefing"
1051,"Coronavirus, Democrats, Harvey Weinstein: Your Wednesday Briefing"
1052,"Coronavirus, Democrats, Milwaukee: Your Thursday Briefing"
1053,"Coronavirus, Financial Markets, Emmanuel Macron: Your Wednesday Briefing"
1054,"Coronavirus, Germany, Storm Ciara: Your Tuesday Briefing"
1055,"Coronavirus, Harvey Weinstein, Brexit: Your Tuesday Briefing"
1056,"Coronavirus, Harvey Weinstein, Kobe Bryant: Your Tuesday Briefing"
1057,"Coronavirus, Iowa Caucuses, Kansas City Chiefs: Your Monday Briefing"
1058,"Coronavirus, Iowa, Brexit: Your Tuesday Briefing"
1059,"Coronavirus, Iowa, Ireland: Your Friday Briefing"
1060,"Coronavirus, Japanese Coal, Iowa Caucuses: Your Tuesday Briefing"
1061,"Coronavirus, Jeff Bezos, George Washington: Your Monday Evening Briefing"
1062,"Coronavirus, Joe Biden, Carnival: Your Wednesday Evening Briefing"
1063,"Coronavirus, Justice Department, Democrats: Your Thursday Briefing"
1064,"Coronavirus, Michael Bloomberg, Boy Scouts: Your Tuesday Briefing"
1065,"Coronavirus, Michael Bloomberg, Kobe Bryant: Your Weekend Briefing"
1066,"Coronavirus, Michael Bloomberg, Mississippi Flooding: Your Monday Briefing"
1067,"Coronavirus, New Hampshire, Oscars: Your Friday Evening Briefing"
1068,"Coronavirus, New Hampshire, T-Mobile: Your Tuesday Briefing"
1069,"Coronavirus, New Hampshire, ‘Parasite’: Your Monday Evening Briefing"
1070,"Coronavirus, South Carolina, Syria: Your Friday Briefing"
1071,"Coronavirus, State of the Union, Iowa: Your Wednesday Briefing"
1072,"Coronavirus, Syria, Afghanistan: Your Friday Briefing"
1073,"Coronavirus, Syria, Ben Affleck: Your Wednesday Briefing"
1074,"Coronavirus, Weinstein, Kobe Bryant: Your Monday Evening Briefing"
1075,"Coronavirus, Wisconsin Shooting, Syrian Refugees: Your Thursday Briefing"
1076,Coronavirus: ¿qué tan grave será la crisis?
1077,"Coronavirus? Yes, but First: Soda Ban. CBS Criticized After a Chaotic Debate."
1078,"Corrections: Feb. 1, 2020"
1079,"Corrections: Feb. 11, 2020"
1080,"Corrections: Feb. 12, 2020"
1081,"Corrections: Feb. 13, 2020"
1082,"Corrections: Feb. 14, 2020"
1083,"Corrections: Feb. 15, 2020"
1084,"Corrections: Feb. 16, 2020"
1085,"Corrections: Feb. 19, 2020"
1086,"Corrections: Feb. 2, 2020"
1087,"Corrections: Feb. 20, 2020"
1088,"Corrections: Feb. 21, 2020"
1089,"Corrections: Feb. 22, 2020"
1090,"Corrections: Feb. 23, 2020"
1091,"Corrections: Feb. 25, 2020"
1092,"Corrections: Feb. 26, 2020"
1093,"Corrections: Feb. 27, 2020"
1094,"Corrections: Feb. 28, 2020"
1095,"Corrections: Feb. 29, 2020"
1096,"Corrections: Feb. 4, 2020"
1097,"Corrections: Feb. 5, 2020"
1098,"Corrections: Feb. 6, 2020"
1099,"Corrections: Feb. 7, 2020"
1100,"Corrections: Feb. 8, 2020"
1101,"Corrections: Feb. 9, 2020"
1102,Cosmopolitan Changes Course on ‘Bachelor’ Contestant Cover
1103,Could Bloomberg Buy the Nomination?
1104,Could Nevada Caucus First in 2024? Harry Reid Wants It
1105,Could a Keto Diet Be Bad for Athletes’ Bones?
1106,Could the Trump Administration Block Congestion Pricing in New York?
1107,Countdown Begins to Possible End of U.S. War in Afghanistan
1108,Couple Tests Positive for Coronavirus After Returning From Vacation in Hawaii
1109,Court Rejects Huawei’s Challenge to U.S. Limits
1110,Court Rules Congress Cannot Sue to Force Executive Branch Officials to Testify
1111,Court Throws Out Emoluments Case Brought Against Trump by Democrats
1112,Cover Story: Spring’s New Casual Fashion
1113,Covering the Coronavirus
1114,Crashing Henry VIII’s Court One Last Time With Hilary Mantel
1115,Crazy Mascots Flooded Japan. Can This Grouchy Boar Survive?
1116,Creamy Pasta Forever
1117,Creating Connections
1118,"Creative Scoring, High Drama and Zion Williamson: All-Star Takeaways"
1119,Credit Suisse C.E.O. Tidjane Thiam Exits After Spying Scandal
1120,Crime Spikes. Is Bail Law to Blame?
1121,Cripple the Intelligence Agencies? Not Smart
1122,Cripple the Intelligence Agencies? Not Smart
1123,Crisis en China
1124,Cruise Giant Carnival Works to Manage Deepening Coronavirus Crisis
1125,"Cruise Ship Passengers, Some Infected, Flown Back to U.S."
1126,"Cruise Ship, Democrats, Academy Awards: Your Monday Briefing"
1127,"Cruise Ship, Oscars, North Korea: Your Tuesday Briefing"
1128,Cruise Ship’s Coronavirus Outbreak Leaves Crew Nowhere to Hide
1129,"Crunchy, Spicy, Peanut-y Noodles Forever"
1130,Cuomo Pledges $40 Million to Combat Coronavirus
1131,Curtailing Free Speech
1132,Cómo fue que las cifras del coronavirus cambiaron tan drásticamente
1133,Cómo prepararse para el coronavirus
1134,Cómo tomar el control de tus notificaciones
1135,D.C. Prosecutors’ Tensions With Justice Dept. Began Long Before Stone Sentencing
1136,DVF Honors RBG
1137,Dagginess as an Australian Asset
1138,"Daimler, Stretched by Diesel Fines and Technology Shift, Records a Loss"
1139,"Damming the Lower Mekong, Devastating the Ways and Means of Life"
1140,Dan Brown … Children’s Book Author?
1141,Dangerous Numbers? Teaching About Data and Statistics Using the Coronavirus Outbreak
1142,"Daniel arap Moi, Autocratic and Durable Kenyan Leader, Dies at 95"
1143,"Daniel, the Golden Retriever Snubbed at Westminster, Is Doing Just Fine"
1144,"Danielle Serbin, Yuvaraj Sivalingam"
1145,Data Driving New Approaches to Transportation
1146,Data Driving New Approaches to Transportation
1147,Data of All 6.5 Million Israeli Voters Is Leaked
1148,David Byrne’s ‘American Utopia’ Will Return to Broadway Next Fall
1149,"David Roback, 61, a Founder of the Band Mazzy Star, Is Dead"
1150,"Dawn Mello, Who Revived Bergdorf Goodman and Gucci, Dies at 88"
1151,Day 10 of Trump’s Trial: The Anticlimax
1152,Daytona 500: How Ryan Newman’s Last Lap Ended in Flames
1153,De Blasio’s New Side Hustle: Trolling Bloomberg
1154,De ‘parásitos’ a socios: así hace negocios el socialismo de Venezuela
1155,DeVos Orders U.S.C. to Address ‘Systemic Failures’ Over Arrested Gynecologist
1156,"Dear CAS: With Flurry of Letters, Russia May Delay Olympic Ban"
1157,Dear Mom and Dad: Are Your Finances Ready for Retirement?
1158,"Dear Oscars, I Love You. But We Need to Talk."
1159,"Deaths in China From Coronavirus Reach 811, Surpassing SARS Toll"
1160,"Deaths in China Rise, With No Sign of Slowdown"
1161,Deaths in China Surpass Toll From SARS
1162,Debate kicks off intense stretch of campaigning in South Carolina.
1163,Debating the Value of PSA Prostate Screening
1164,"Deborah A. Batts, First Openly Gay Federal Judge, Dies at 72"
1165,Dee Rees and the Art of Surviving as a Black Female Director
1166,Deer Overpopulation Meets Its Match: Women Who Hunt
1167,Defending Children
1168,"Defense Minister Was on the Line, Asking for Millions to Aid France. Or Was He?"
1169,"Degas Is Having a Moment, Again"
1170,Delaware turns out for Biden.
1171,Delayed Results Lead to Confusion in Iowa
1172,Delays Mar Iowa Caucuses as Democrats Start Nominating Process
1173,Delfina Delettrez on Twisting the Rules
1174,"Delta Plans to Go Carbon Neutral. Yes, You Read That Right."
1175,Democratic Candidates Focus on All-Consuming Hunger to Unseat Trump
1176,"Democratic Candidates Reject Trump’s Foreign Policy, but Don’t Agree on Theirs"
1177,Democratic Leaders Willing to Risk Party Damage to Stop Bernie Sanders
1178,"Democratic Party, Germany, Victoria’s Secret: Your Thursday Briefing"
1179,Democratic Rivals Are Fighting Over Obama. He Has Some Opinions.
1180,Democratic group swoops in to help candidates fight Trump.
1181,Democratic super PAC swoops in to help candidates fight Trump.
1182,Democrats Are Ignoring the Voters Who Could Decide This Election
1183,Democrats Block Abortion-Related Bills as Republicans Seek Election Advantage
1184,Democrats Counter Trump on Health Care and Condemn His Conduct
1185,Democrats Discuss Abortion Rights in Depth at Debate
1186,Democrats Gave Obama a Free Pass. That Could Hurt Us on Election Day.
1187,"Democrats Get the Attention, but Trump Aims to Put New Hampshire in Play"
1188,Democrats Had a 2020 Vision. This Isn’t Quite What They Expected.
1189,Democrats Look Ahead From Nevada and See a Common Enemy: Bloomberg
1190,Democrats Make Final Appeals in a Cloudy 2020 Iowa Caucus Race
1191,Democrats Pan Trump’s Coronavirus Response As Markets Plunge
1192,Democrats Pile on Bernie Sanders as Urgency Grows
1193,Democrats Plan to Highlight Health Care and Jobs Over Investigating Trump
1194,Democrats Set a TV Ratings Record at Their Las Vegas Debate
1195,Democrats Turn to Gov. Gretchen Whitmer of Michigan for Trump State of the Union Response
1196,Democrats and White House Rest Cases as Impeachment Sputters Toward a Verdict
1197,Democrats are closely watching the turnout after a disappointing Iowa.
1198,Democrats criticize D.N.C. change to debate rules.
1199,Democrats for Low Wages
1200,Democrats thrive in the shadow of a Whole Foods. Here’s why that may be trouble.
1201,Democrats unsuccessfully try to force four amendments.
1202,"Democrats, Coronavirus, the Oscars: Your Friday Briefing"
1203,"Democrats, Don’t Wish for Your Own Rogue"
1204,"Democrats, Knocked Back by Trump’s Acquittal, Ponder Their Next Steps"
1205,"Democrats, Roger Stone, Condé Nast: Your Wednesday Evening Briefing"
1206,"Democrats, Your Time Is Running Out"
1207,"Dems, You Can Defeat Trump in a Landslide"
1208,Denver Mayor Says Pit Bull Ban Will Stand
1209,"Denver Pit Bull Ban, in Place 30 Years, Could Be Lifted"
1210,"Deontay Wilder and Tyson Fury Are Fighting, but Also Bringing Rivals Together"
1211,Deontay Wilder’s Costume Was Heavyweight Camp
1212,Deputy Secretary of Veterans Affairs Is Abruptly Dismissed
1213,Des Moines Register Poll of Iowa Caucusgoers Abruptly Shelved
1214,"Des Moines precinct leader called, texted and continues to wait for the results to be reported."
1215,Desmantelar el narco-Estado en México
1216,"Despite Evidence, Republicans Rallied Behind Trump. This Was Their Reasoning."
1217,"Despite His Billions, Bloomberg Busts"
1218,"Despite a gloomy prediction, Biden says he’s ‘feeling good.’"
1219,"Despite new evidence, Trump defense team again denies quid pro quo."
1220,"Despite new evidence, Trump defense team again denies there was a quid pro quo."
1221,"Deval Patrick, Latecomer to the 2020 Race, Drops Out"
1222,Developers of Upper West Side Condo Tower May Have to Deconstruct 20 Floors
1223,De’Andre Arnold on First Red Carpet: the ‘Kid With Dreads Is at the Oscars’
1224,"Diamond Princess Evacuations, Xinjiang Document, ‘Love Island’: Your Tuesday Briefing"
1225,"Diana Serra Cary, ‘Baby Peggy’ of Silent Films, Dies at 101"
1226,Diane von Furstenberg’s Magic Talismans
1227,Dickson’s Moves Downstairs at Chelsea Market
1228,Did Biden Scare Off Our Next President?
1229,Did Fox News Edit an Interview at Trump’s Request? Chris Wallace Says No
1230,Did William Barr Throw Down the Gauntlet?
1231,Did You Know There Are College Junior Varsity Basketball Teams? North Carolina Has One
1232,Did You Watch the Super Bowl? What Did You Think?
1233,Digging Into Oil Sands Divestment
1234,"Digital Edits, a Paid Army: Bloomberg Is ‘Destroying Norms’ on Social Media"
1235,Digital Tax Fight Emerges as Global Economic Threat
1236,"Dijo que no quería un examen pélvico, pero se lo hicieron de todas formas"
1237,Dinner Theater California-Style
1238,Dinners Laud Chefs at Beatrice Inn
1239,Diplomat at Center of Trump Impeachment Retires From State Department
1240,Disabled Train and Power Failure Bring Delays for Thousands at Penn Station
1241,Disabled Train and Power Failure Bring Delays for Thousands at Penn Station
1242,Disappointed by the Oscars? You Are Not Alone
1243,"Disclosure of Plácido Domingo Allegations Scuttles $500,000 Deal"
1244,Dismantling Mexico’s Narco State
1245,Disney C.E.O. Apologizes to P.T.A. Asked to Pay After ‘Lion King’ Screening
1246,Disney C.E.O. Bob Iger Hands Keys to Magic Kingdom to Its 7th Chief
1247,Disney Plus Racks Up 28.6 Million Subscribers
1248,Divisiveness Among 2020 Democratic Hopefuls Hits New Level
1249,Divisiveness Among 2020 Democratic Hopefuls Hits New Level
1250,Divisiveness Among 2020 Democratic Hopefuls Hits New Low
1251,"Dixville Notch has voted, and the winner is … Bloomberg."
1252,"Dixville Notch votes, and the winner is … Bloomberg."
1253,"Dixville Notch votes, and the winner is … Bloomberg."
1254,Do Chicken Breasts Deserve A Comeback?
